Reversed left context,Reversed center,Left context,Center,Punct,Right context,Title,Author,Birthday,Header,Created,Sphere,Type,Topic,Publication,Publ_year,Medium,Ambiguity,Full context
":ълибюл ъкат отч ,от ълянирпсов", йыртсо ,"воспринялъ то, что такъ любилъ:", острый , ," запахъ сыроватаго дерна, упругость его",В. В. Набоков. Подвиг (1932),В. В. Набоков,1899,Подвиг,1932,художественная,роман,_,,,книга,омонимия не снята,"Погодя всѣ одиннадцать человѣкъ гуськомъ выбѣжали изъ павильона, и Мартынъ разомъ воспринялъ то, что такъ любилъ:острый запахъ сыроватаго дерна, упругость его подъ ногой, тысячу людей на скамейкахъ, черную проплѣшину въ дернѣ у воротъ и гулкій звукъ, ― это покикивала противная команда. [В. В. Набоков. Подвиг (1932)] [омонимия не снята]"
.волуксум икзявс и икчуп еывелод, йыртсО ,долевые пучки и связки мускулов., Острый , ," запах крови, как тогда, вызвал",М. А. Шолохов. Поднятая целина. Книга 1 (1932),М. А. Шолохов,1905,Поднятая целина. Книга 1,1932,художественная,роман,_,,,книга,омонимия не снята,"долевые пучки и связки мускулов. Острый запах крови, как тогда, вызвал припадок тошноты, заставил качнуться. [М. А. Шолохов. Поднятая целина. Книга 1 (1932)] [омонимия не снята]"
.мосавк тюавилаз и молсам мынялпонок, йыртсО ,конопляным маслом и заливают квасом., Острый , , запах мурцовки мешается с запахом,И. С. Шмелев. Богомолье (1930-1931),И. С. Шмелев,1873,Богомолье,1930-1931,художественная,повесть,_,,,книга,омонимия не снята,конопляным маслом и заливают квасом. Острый запах мурцовки мешается с запахом цветов. [И. С. Шмелев. Богомолье (1930-1931)] [омонимия не снята]
",рагис хывёшед и кобурт амыд", огортсо ,"дыма трубок и дешёвых сигар,", острого , , запаха женского пота и тошнотворно-,Н. Н. Шпанов. Домик у пролива (1930),Н. Н. Шпанов,1896,Домик у пролива,1930,художественная,повесть,_,,,книга,омонимия не снята,"Разноязычный говор сливался в неясный гул, фонари, огромные, как решета, лили расслабленный свет в воздух, представлявший собою густую смесь из сладко терпкого дыма трубок и дешёвых сигар,острого запаха женского пота и тошнотворно- приторной пудры. [Н. Н. Шпанов. Домик у пролива (1930)] [омонимия не снята]"
"он ,йикгёл лидохси ёен тО", йыртсо ,"От неё исходил лёгкий, но", острый , ," запах чеснока, черемши и ещё",Н. Н. Шпанов. Домик у пролива (1930),Н. Н. Шпанов,1896,Домик у пролива,1930,художественная,повесть,_,,,книга,омонимия не снята,"От неё исходил лёгкий, ноострый запах чеснока, черемши и ещё чего-то трудно определимого, но непременно присущего китайским прачкам и портным. [Н. Н. Шпанов. Домик у пролива (1930)] [омонимия не снята]"
"с ьсишвашемс ,ьнов огЕ", мыртсо ,"Его вонь, смешавшись с", острым , ," запахом чеснока, пота и отхожих",Н. Н. Шпанов. Домик у пролива (1930),Н. Н. Шпанов,1896,Домик у пролива,1930,художественная,повесть,_,,,книга,омонимия не снята,"Его вонь, смешавшись сострым запахом чеснока, пота и отхожих мест, ударила в нос так, что даже попривыкший уже Ласкин замотал головой. [Н. Н. Шпанов. Домик у пролива (1930)] [омонимия не снята]"
"и йикзилб он ,итремс к", йыртсо ,"к смерти, но близкий и", острый , , запах « Шипра» заставил веки,С. Д. Кржижановский. Странствующее «странно» (1930),С. Д. Кржижановский,1887,Странствующее «странно»,1930,художественная,повесть,_,,,книга,омонимия не снята,"В ужасе, я сжал веки, приготовившись к смерти, но близкий иострый запах « Шипра» заставил веки разжаться снова. [С. Д. Кржижановский. Странствующее «странно» (1930)] [омонимия не снята]"
ирдзон олапарацо енм »арпиШ «, мыртсо ,« Шипра» мне оцарапало ноздри, острым , ," запахом ртути и спирта, я",С. Д. Кржижановский. Странствующее «странно» (1930),С. Д. Кржижановский,1887,Странствующее «странно»,1930,художественная,повесть,_,,,книга,омонимия не снята,"Лишь когда вместо милого « Шипра» мне оцарапало ноздриострым запахом ртути и спирта, я понял, что сбился с дороги. [С. Д. Кржижановский. Странствующее «странно» (1930)] [омонимия не снята]"
"яслисонод инхук зи ,ысач илаклещ", йыртсо ,"щелкали часы, из кухни доносился", острый , , запах соленой рыбы.,Максим Горький. Жизнь Клима Самгина. Часть 3 (1928),Максим Горький,1868,Жизнь Клима Самгина. Часть 3,1928,художественная,роман,_,,,книга,омонимия не снята,"В кармане жилета замедленно щелкали часы, из кухни доносилсяострый запах соленой рыбы. [Максим Горький. Жизнь Клима Самгина. Часть 3 (1928)] [омонимия не снята]"
"илавовтсвучоп идюл ыботч ,ецдрес еокстед", йыртсо ,"детское сердце, чтобы люди почувствовали", острый , , запах судьбы вокруг человека.,Ю. Н. Тынянов. Смерть Вазир-Мухтара (1928),Ю. Н. Тынянов,1894,Смерть Вазир-Мухтара,1928,художественная,роман,_,,,книга,омонимия не снята,"Должно было выйти за литературу, за столичную жизнь, размахнуться Кавказом и Персией, до конца износить легкое, детское сердце, чтобы люди почувствовалиострый запах судьбы вокруг человека. [Ю. Н. Тынянов. Смерть Вазир-Мухтара (1928)] [омонимия не снята]"
".ежилб лешодоп ,игаш яашиту ,нитнавК", йыртсО ,"Квантин, утишая шаги, подошел ближе.", Острый , , запах проникал сквозь ноздри в,С. Д. Кржижановский. Боковая ветка (1927-1928),С. Д. Кржижановский,1887,Боковая ветка,1927-1928,художественная,рассказ,_,,,книга,омонимия не снята,"Квантин, утишая шаги, подошел ближе. Острый запах проникал сквозь ноздри в мозг. [С. Д. Кржижановский. Боковая ветка (1927-1928)] [омонимия не снята]"
вонахраб аз-зи олунуд елачанВ, мыртсо ,Вначале дунуло из-за барханов, острым , ," душком кизячного дыма, и от",Б. А. Лавренев. Сорок первый (1924),Б. А. Лавренев,1891,Сорок первый,1924,художественная,повесть,_,,,книга,омонимия не снята,"Вначале дунуло из-за бархановострым душком кизячного дыма, и от запаха сжало желудки едкой спазмой. [Б. А. Лавренев. Сорок первый (1924)] [омонимия не снята]"
"…монтяп мыла иляиз ,морап мылпет", йыртсО ,"теплым паром, зияли алым пятном…", Острый , ," запах крови был привычен, ―",Б. Губер. Шарашкина контора (1924),Б. Губер,1903,Шарашкина контора,1924,художественная,повесть,_,,,книга,омонимия не снята,"теплым паром, зияли алым пятном… Острый запах крови был привычен, ― кровь стекала ручейками в канавку, мешалась с навозной жижей, текла в подворотню… [Б. Губер. Шарашкина контора (1924)] [омонимия не снята]"
"яслинмопаз ― ,инерис вотсук елзов", йыртсо ,"возле кустов сирени, ― запомнился", острый , ," запах шпанских мух, ― он,",И. А. Бунин. Митина любовь (1924),И. А. Бунин,1870,Митина любовь,1924,художественная,повесть,_,,,книга,омонимия не снята,"Когда-то и где-то, должно быть, тоже весной, в саду, возле кустов сирени, ― запомнилсяострый запах шпанских мух, ― он, совсем маленький, стоял с какой-то молодой женщиной, ― вероятно, с своей нянькой, ― и вдруг что-то точно озарилось перед ним небесным светом, ― не то лицо ее, не то сарафан на полной груди, ― и что-то горячей волной прошло, взыграло в нем, истинно как дитя во чреве матери… [И. А. Бунин. Митина любовь (1924)] [омонимия не снята]"
ляотС, йыртсо ,Стоял, острый , ," запах тепла, конюшен, опилок и",А. С. Грин. Блистающий мир (1923),А. С. Грин,1880,Блистающий мир,1923,художественная,рассказ,_,,,книга,омонимия не снята,"Стоялострый запах тепла, конюшен, опилок и тонких духов ― традиционный аромат цирка, родственный пестроте представления. [А. С. Грин. Блистающий мир (1923)] [омонимия не снята]"
и имикориш с одатс еонморго, имыртсо ,огромное стадо с широкими и, острыми , , запахами.,Вс. В. Иванов. Голубые пески (1923),Вс. В. Иванов,1895,Голубые пески,1923,художественная,повесть,_,,,книга,омонимия не снята,"Женщин Балиханов, как все азиаты, любил полных, чтобы мясо плыло, как огромное стадо с широкими иострыми запахами. [Вс. В. Иванов. Голубые пески (1923)] [омонимия не снята]"
.водолп юьтсежят доп илмез од, йыртсО ,до земли под тяжестью плодов., Острый , ," запах окутал сады, там гомонили",Максим Горький. Мои университеты (1923),Максим Горький,1868,Мои университеты,1923,художественная,повесть,_,,,книга,омонимия не снята,"до земли под тяжестью плодов. Острый запах окутал сады, там гомонили дети, собирая червобоину и сбитые ветром жёлтые и розовые яблоки. [Максим Горький. Мои университеты (1923)] [омонимия не снята]"
"с ,акчотсил хишьлобен авд илыб", мыртсо ,"были два небольших листочка, с", острым , , запахом свежей типографской краски.,В. М. Чернов. Записки социалиста революционера (1922),В. М. Чернов,1873,Записки социалиста революционера,1922,"нехудожественная, публицистика",мемуары,_,,,книга,омонимия не снята,"То были два небольших листочка, сострым запахом свежей типографской краски. [В. М. Чернов. Записки социалиста революционера (1922)] [омонимия не снята]"
"йымоканз и ,улоп ан атоп", йыртсо ,"пота на полу, и знакомый", острый , ," запах душил меня, как выхухоль;",Д. С. Мережковский. Александр Первый (1922),Д. С. Мережковский,1866,Александр Первый,1922,художественная,роман,_,,,книга,омонимия не снята,"Я глядел, и голова у меня кружилась; иногда забывался, как будто терял сознание, и казалось мне, что вместе со всеми лечу и я; иногда опоминался и видел, как плясуны, изнеможенные, остановившись, выжимали мокрые от пота рубахи, вытирали полотенцами лужи пота на полу, и знакомыйострый запах душил меня, как выхухоль; но тотчас же опять забывался я. [Д. С. Мережковский. Александр Первый (1922)] [омонимия не снята]"
В, мортсо ,В, остром , , запахе тающих смол 	 Подо,М. А. Бекетова. В цепях тягостной свободы... (1922),М. А. Бекетова,1862,В цепях тягостной свободы...,1922,"нехудожественная, публицистика",мемуары,искусство и культура,,,книга,омонимия не снята,Востром запахе тающих смол 	 Подо мной распахнулась окрестность… [М. А. Бекетова. В цепях тягостной свободы... (1922)] [омонимия не снята]
"и вохуд ,ырдуп йовосир ,асуксум", мыртсо ,"мускуса, рисовой пудры, духов и", острым , , запахом страсти.,П. Н. Краснов. От Двуглавого Орла к красному знамени (книга 1) (1922),П. Н. Краснов,1869,От Двуглавого Орла к красному знамени (книга 1),1922,художественная,роман,_,,,книга,омонимия не снята,"Она наполнила весь кабинет раздражающим запахом мускуса, рисовой пудры, духов иострым запахом страсти. [П. Н. Краснов. От Двуглавого Орла к красному знамени (книга 1) (1922)] [омонимия не снята]"
и йымоканз яахыдв и ее, йыртсо ,ее и вдыхая знакомый и, острый , ," запах лошадиного пота, он шептал ей","Б. В. Савинков (В. Ропшин). То, чего не было (1918)",Б. В. Савинков (В. Ропшин),1879,"То, чего не было",1918,художественная,роман,"история, политика и общественная жизнь",,,книга,омонимия не снята,"Целуя ее и вдыхая знакомый иострый запах лошадиного пота, он шептал ей ласковые слова:  [Б. В. Савинков (В. Ропшин). То, чего не было (1918)] [омонимия не снята]"
",йижевс ушылс я отч ,ястежак", йыртсо ,"кажется, что я слышу свежий,", острый , ," запах новых слов, чувствую, как",Максим Горький. Несвоевременные мысли (1917-1918),Максим Горький,1868,Несвоевременные мысли,1917-1918,"нехудожественная, публицистика",статья,"искусство и культура, политика и общественная жизнь",,,книга,омонимия не снята,"Город, как улей весной, когда проснулись пчелы; мне кажется, что я слышу свежий,острый запах новых слов, чувствую, как всюду творится мед и воск новых мыслей. [Максим Горький. Несвоевременные мысли (1917-1918)] [омонимия не снята]"
азалг ле омипретсен хародирок хиксечимедака, йыртсо ,академических коридорах нестерпимо ел глаза, острый , , запах миазмов от удобств старого,И. Е. Репин. Далекое близкое (1912-1917),И. Е. Репин,1844,Далекое близкое,1912-1917,"нехудожественная, публицистика",мемуары,_,,,книга,омонимия не снята,"В длинных академических коридорах нестерпимо ел глазаострый запах миазмов от удобств старого закала: коридоры еще не были разгорожены, как теперь. [И. Е. Репин. Далекое близкое (1912-1917)] [омонимия не снята]"
"олхап адгесв ,йотсадург и йоньлис", мыртсо ,"сильной и грудастой, всегда пахло", острым , ," запахом лошадиного пота, как от","А. Н. Будищев. Изломы любви // журнал «Пробуждение», 1912, No 4, 1912",А. Н. Будищев,1867,Изломы любви,1912,художественная,рассказ,_,"журнал «Пробуждение», 1912, No 4",1912,журнал,омонимия не снята,"И притом от всей ее фигуры ― широкой, сильной и грудастой, всегда пахлоострым запахом лошадиного пота, как от лошади, которую только что, после скачки, расседлали. [А. Н. Будищев. Изломы любви // журнал «Пробуждение», 1912, No 4, 1912] [омонимия не снята]"
"и ,лепос олежят ахупраК", йыртсо ,"Карпуха тяжело сопел, и", острый , , запах пота отделялся от его,А. Н. Будищев. Семибоярские (1912),А. Н. Будищев,1867,Семибоярские,1912,художественная,рассказ,_,,,книга,омонимия не снята,"Карпуха тяжело сопел, иострый запах пота отделялся от его розовой щегольской рубахи с малиновыми гранеными пуговицами. [А. Н. Будищев. Семибоярские (1912)] [омонимия не снята]"
".акдолом ,отч аляретоп илА", йыртсО ,"Али потеряла что, молодка.", Острый , ," запах цигарки, картуз ловкий, крепкие,",Б. К. Зайцев. Аграфена (1908),Б. К. Зайцев,1881,Аграфена,1908,художественная,повесть,_,,,книга,омонимия не снята,"Али потеряла что, молодка. Острый запах цигарки, картуз ловкий, крепкие, как из жил, руки. [Б. К. Зайцев. Аграфена (1908)] [омонимия не снята]"
ёен то лидохси окьлот :ынйат, йыртсо ,тайны: только исходил от неё, острый , , запах каких-то трав.,В. Я. Брюсов. Огненный ангел (1908),В. Я. Брюсов,1873,Огненный ангел,1908,художественная,роман,_,,,книга,омонимия не снята,"Потом, при свете сальной лампочки, раскрыл я ящичек с мазью, данной мне Ренатою, и попытался определить её состав, но зеленоватая, жирная масса не выдавала своей тайны: только исходил от неёострый запах каких-то трав. [В. Я. Брюсов. Огненный ангел (1908)] [омонимия не снята]"
"с ьтсокдиж ясяащямыд ,ьтсокдиж яачугж", мыртсо ,"жгучая жидкость, дымящаяся жидкость с", острым , ," запахом, бурый землистый налет на",Н. О. Лосский. Обоснование интуитивизма (1906-1908),Н. О. Лосский,1870,Обоснование интуитивизма,1906-1908,"нехудожественная, учебно-научная",монография,философия,,,книга,омонимия не снята,"Утверждая, что железная вещь, лежащая в воде, покрывается ржавчиной или что прибавление соляной кислоты к раствору ляписа приводит к образованию хлористого серебра, мы опять-таки имеем дело с объектами, которые налицо в самом процесс знания: прозрачная, пресная на вкус жидкость, жгучая жидкость, дымящаяся жидкость сострым запахом, бурый землистый налет на металле, белые хлопья осаждающегося хлористого серебра и т. д. присутствуют в процессе утверждения [Н. О. Лосский. Обоснование интуитивизма (1906-1908)] [омонимия не снята]"
"оге дереп ,моцбереж мыннеревуомас мыннилд", мыртсо ,"длинным самоуверенным жеребцом, перед его", острым , ," запахом злой лошади, крутым верблюжьим",А. И. Куприн. Изумруд (1907),А. И. Куприн,1870,Изумруд,1907,художественная,рассказ,_,,,книга,омонимия не снята,"Но Изумруд чувствовал в душе некоторую боязнь перед этим длинным самоуверенным жеребцом, перед егоострым запахом злой лошади, крутым верблюжьим кадыком, мрачными запавшими глазами и особенно перед его крепким, точно каменным, костяком, закаленным годами, усиленным бегом и прежними драками. [А. И. Куприн. Изумруд (1907)] [омонимия не снята]"
