Reversed left context,Reversed center,Left context,Center,Punct,Right context,Title,Author,Birthday,Header,Created,Sphere,Type,Topic,Publication,Publ_year,Medium,Ambiguity,Full context
 тюазерыв икйобан и иктемдоП, мыртсо ,Подметки и набойки вырезают , острым , , ножом из куска резины толщиной,"обобщенный. Починка резиновых сапог // Охота и охотничье хозяйство, 1969",обобщенный,,Починка резиновых сапог,1969,"нехудожественная, публицистика",совет,дом и домашнее хозяйство,Охота и охотничье хозяйство,1969,журнал,омонимия не снята,"Подметки и набойки вырезают острым ножом из куска резины толщиной 3— 4 мм ( за неимением лучшего годится кусок старой автопокрышки), причем те и другие должны быть немного больше подошвы или каблука, для которых они предназначены. [обобщенный. Починка резиновых сапог // Охота и охотничье хозяйство, 1969] [омонимия не снята]"
" тюазербо ,агопас ьтазерорп ен ыботч", мыртсо ,"чтобы не прорезать сапога, обрезают ", острым , , ножом.,"обобщенный. Починка резиновых сапог // Охота и охотничье хозяйство, 1969",обобщенный,,Починка резиновых сапог,1969,"нехудожественная, публицистика",совет,дом и домашнее хозяйство,Охота и охотничье хозяйство,1969,журнал,омонимия не снята,"Через несколько часов, когда подметка схватится с сапогом намертво, все ее выступающие края осторожно, чтобы не прорезать сапога, обрезают острым ножом. [обобщенный. Починка резиновых сапог // Охота и охотничье хозяйство, 1969] [омонимия не снята]"
" еоннечречорп ещюажоргу ,обен еонченлоссеб ,еонтум", имыртсо ,"мутное, бессолнечное небо, угрожающе прочерченное ", острыми , , пиками боевых головок ― ужасных,И. А. Ефремов. Час быка (1968-1969),И. А. Ефремов,1908,Час быка,1968-1969,художественная,роман,_,,,книга,омонимия не снята,"Низко нависло мутное, бессолнечное небо, угрожающе прочерченное острыми пиками боевых головок ― ужасных носителей термоядерной смерти. [И. А. Ефремов. Час быка (1968-1969)] [омонимия не снята]"
 хабигзи ее ан угород илакесереп, имыртсо ,пересекали дорогу на ее изгибах , острыми , , гребешками.,И. А. Ефремов. Час быка (1968-1969),И. А. Ефремов,1908,Час быка,1968-1969,художественная,роман,_,,,книга,омонимия не снята,Песчаные наметы пересекали дорогу на ее изгибах острыми гребешками. [И. А. Ефремов. Час быка (1968-1969)] [омонимия не снята]
" илачрот ,йокшабур йовоклеш йогород доп", еыртсо ,"под дорогой шелковой рубашкой, торчали ", острые , , лопатки.,Василий Шукшин. Кукушкины слезки (1968),Василий Шукшин,1929,Кукушкины слезки,1968,художественная,рассказ,_,,,книга,омонимия не снята,"На узкой спине его, под дорогой шелковой рубашкой, торчали острые лопатки. [Василий Шукшин. Кукушкины слезки (1968)] [омонимия не снята]"
.макиратс мымеажаву мымас оно ястеачуроп, мыртсО ,поручается оно самым уважаемым старикам., Острым , , ножом старик осторожно снимает кору.,"Г. Навлицкая. Айны // «Вокруг света», 1968",Г. Навлицкая,,Айны,1968,"нехудожественная, публицистика",очерк,путешествия,«Вокруг света»,1968,журнал,омонимия не снята,"поручается оно самым уважаемым старикам. Острым ножом старик осторожно снимает кору. [Г. Навлицкая. Айны // «Вокруг света», 1968] [омонимия не снята]"
 И, йыртсо ,И , острый , , кинжал 	 У нее в,К. И. Чуковский. Высокое искусство (1968),К. И. Чуковский,1882,Высокое искусство,1968,"нехудожественная, учебно-научная",монография,"наука и технологии, филология",,,книга,омонимия не снята,"И острый кинжал 	 У нее в руке 	 Задрожал,  	 Ищет смерти она в тоске. [К. И. Чуковский. Высокое искусство (1968)] [омонимия не снята]"
 ыделс илинархос хынтовиж хынчыбо яинежарбози, хыртсо ,изображения обычных животных сохранили следы , острых , ," копий и топоров, то на","Л. Заседателева. Так танец разгорается кругами // «Вокруг света», 1968",Л. Заседателева,,Так танец разгорается кругами,1968,"нехудожественная, публицистика",очерк,искусство и культура,«Вокруг света»,1968,журнал,омонимия не снята,"И если изображения обычных животных сохранили следы острых копий и топоров, то на оборотнях ― ни царапины. [Л. Заседателева. Так танец разгорается кругами // «Вокруг света», 1968] [омонимия не снята]"
 и оген ан ьсалисорб итсонвер, юортсо ,ревности бросилась на него и , острою , , бритвою отрезала ему нос.,Н. О. Лосский. Воспоминания: жизнь и философский путь (1968),Н. О. Лосский,1870,Воспоминания: жизнь и философский путь,1968,"нехудожественная, публицистика",мемуары,_,,,книга,омонимия не снята,"У сына мельника, молодого человека, был какой‑ то роман с местной мещанкою; влюбленная в него девица в припадке ревности бросилась на него и острою бритвою отрезала ему нос. [Н. О. Лосский. Воспоминания: жизнь и философский путь (1968)] [омонимия не снята]"
" ,аварт ьсаладзар ,игаш илетселешорп екшурог", яартсо ,"горушке прошелестели шаги, раздалась трава, ", острая , , лопата вонзилась в сладко- сырую,Виль Липатов. Деревенский детектив (1967-1968),Виль Липатов,1927,Деревенский детектив,1967-1968,художественная,повесть,_,,,книга,омонимия не снята,"Показалось, что на горушке прошелестели шаги, раздалась трава, острая лопата вонзилась в сладко- сырую землю… [Виль Липатов. Деревенский детектив (1967-1968)] [омонимия не снята]"
 унипс лолок и ьртунв яслариборп, имыртсо ,пробирался внутрь и колол спину , острыми , , иголками.,Альберт Лиханов. Чистые камушки (1967),Альберт Лиханов,1935,Чистые камушки,1967,художественная,повесть,_,,,книга,омонимия не снята,Ветер пробирался внутрь и колол спину острыми иголками. [Альберт Лиханов. Чистые камушки (1967)] [омонимия не снята]
 йошьлоб екшиМ ладоп чивонакирфА навИ, йыртсо ,Иван Африканович подал Мишке большой , острый , , нож.,Василий Белов. Привычное дело (1967),Василий Белов,1932,Привычное дело,1967,художественная,повесть,_,,,книга,омонимия не снята,Иван Африканович подал Мишке большой острый нож. [Василий Белов. Привычное дело (1967)] [омонимия не снята]
 ястентемзв и тевто в ман, йыртсо ,нам в ответ и взметнется , острый , , пик на экране.,Евгений Велтистов. Глоток солнца (1967),Евгений Велтистов,1934,Глоток солнца,1967,художественная,повесть,_,,,книга,омонимия не снята,Мы ждали непривычных зубцов ― вот сейчас облако крикнет нам в ответ и взметнется острый пик на экране. [Евгений Велтистов. Глоток солнца (1967)] [омонимия не снята]
 даН, имыртсо ,Над , острыми , ," пиками елей, прямо надо мной",Евгений Велтистов. Глоток солнца (1967),Евгений Велтистов,1934,Глоток солнца,1967,художественная,повесть,_,,,книга,омонимия не снята,"Над острыми пиками елей, прямо надо мной висело облако. [Евгений Велтистов. Глоток солнца (1967)] [омонимия не снята]"
 с етсемВ « ― ьтепс, йортсо ,спеть ― « Вместе с , острой , , саблей пику подари» и «,Михаил Анчаров. Этот синий апрель (1967),Михаил Анчаров,1923,Этот синий апрель,1967,художественная,повесть,_,,,книга,омонимия не снята,"А потом развеселились и даже пытались спеть ― « Вместе с острой саблей пику подари» и « Не спи, вставай, кудрявая». [Михаил Анчаров. Этот синий апрель (1967)] [омонимия не снята]"
" тюад ен мятед отч ,теанз", огортсо ,"знает, что детям не дают ", острого ,: ," ножей, ножниц, вилок и тому",А. И. Пантелеев. Наша Маша (1966),А. И. Пантелеев,1908,Наша Маша,1966,"нехудожественная, публицистика","дневник, записные книжки",_,,,книга,омонимия не снята,"Маша знает, что детям не дают острого: ножей, ножниц, вилок и тому подобного. [А. И. Пантелеев. Наша Маша (1966)] [омонимия не снята]"
 литсичо мортемиллим аз ртемиллим ротарватсер, мыртсо ,реставратор миллиметр за миллиметром очистил , острым , , скальпелем поверхность мандата от наклеек,"А. Петров, Н. Анисимова. Ленинским документам — долгую жизнь // «Химия и жизнь», 1966","А. Петров, Н. Анисимова",,Ленинским документам — долгую жизнь,1966,"нехудожественная, публицистика",статья,"наука и технологии, политика и общественная жизнь, химия",«Химия и жизнь»,1966,журнал,омонимия не снята,"Соблюдая предельную осторожность, реставратор миллиметр за миллиметром очистил острым скальпелем поверхность мандата от наклеек и застывшего клея. [А. Петров, Н. Анисимова. Ленинским документам — долгую жизнь // «Химия и жизнь», 1966] [омонимия не снята]"
 еытурк еьдовоклем ан велодоерП, еыртсо ,Преодолев на мелководье крутые , острые , ," гребни волн, выплыл на глубину","П. Курилов. У Кекур пять пальцев // «Спортсмен-подводник», 1966",П. Курилов,,У Кекур пять пальцев,1966,"нехудожественная, публицистика",статья,путешествия,«Спортсмен-подводник»,1966,журнал,омонимия не снята,"Преодолев на мелководье крутые острые гребни волн, выплыл на глубину и, покачиваясь на волнах, стал заряжать ружье. [П. Курилов. У Кекур пять пальцев // «Спортсмен-подводник», 1966] [омонимия не снята]"
" миовс кабат лазер ядяд ,олавыб", мыртсо ,"бывало, дядя резал табак своим ", острым , ," топориком, а потом, выхватив из",Фазиль Искандер. Созвездие Козлотура (1966),Фазиль Искандер,1929,Созвездие Козлотура,1966,художественная,повесть,_,,,книга,омонимия не снята,"На этой скамье, бывало, дядя резал табак своим острым топориком, а потом, выхватив из очага горящий уголек, бросал его в горку нарезанного табака и медленно, с удовольствием копнил эту дымящуюся горку, чтобы она как следует просушилась и пропиталась ароматом древесного дыма. [Фазиль Искандер. Созвездие Козлотура (1966)] [омонимия не снята]"
" екур в теарги ,оселок яститурк", йыртсо ,"крутится колесо, играет в руке ", острый , ," нож, листик пергамента слетает под",Н. Н. Берберова. Курсив мой (1960-1966),Н. Н. Берберова,1901,Курсив мой,1960-1966,художественная,роман,искусство и культура,,,книга,омонимия не снята,"У нее губы, как ломтики ветчины, пальцы ― розовые колбаски, глаза ― черные блестящие маслины, и она за стеклом растворяется среди окороков и свиных котлет, так что, когда входит покупатель, он ищет ее глазами, и вот она воплощается снова, и снова крутится колесо, играет в руке острый нож, листик пергамента слетает под сосиску, качается стрелка весов и извечным звуком ― трах-тарарах- тррр ― гремит железная касса. [Н. Н. Берберова. Курсив мой (1960-1966)] [омонимия не снята]"
 и ястеавырс акур яом яавел, йыртсо ,левая моя рука срывается и , острый , , гребешок разрезает манжет костюма.,"В. Бровко. Исследование подземных водоемов спортсменами-подводниками // «Спортсмен-подводник», 1965",В. Бровко,,Исследование подземных водоемов спортсменами-подводниками,1965,"нехудожественная, публицистика",статья,"путешествия, спорт",«Спортсмен-подводник»,1965,журнал,омонимия не снята,"Вдруг левая моя рука срывается и острый гребешок разрезает манжет костюма. [В. Бровко. Исследование подземных водоемов спортсменами-подводниками // «Спортсмен-подводник», 1965] [омонимия не снята]"
" илавозарбо ,оньливарпен ьсядохс ,ынетс евд", йыртсо ,"две стены, сходясь неправильно, образовали ", острый , , косой угол.,В. Ф. Панова. Конспект романа (1965),В. Ф. Панова,1905,Конспект романа,1965,художественная,рассказ,_,,,книга,омонимия не снята,"Она находилась в глубине двора, слева, где две стены, сходясь неправильно, образовали острый косой угол. [В. Ф. Панова. Конспект романа (1965)] [омонимия не снята]"
 ьнечо ен и мытаволежят митэ, мыртсо ,этим тяжеловатым и не очень , острым , ," оружием он владел превосходно, потому",Ирина Стрелкова. И еще два дня (1965),Ирина Стрелкова,1924,И еще два дня,1965,художественная,рассказ,_,,,книга,омонимия не снята,"Но этим тяжеловатым и не очень острым оружием он владел превосходно, потому что бил в одну точку с непоколебимой уверенностью, что или надо сделать так, как говорит Харитонов, или что-то сделать с самим Харитоновым. [Ирина Стрелкова. И еще два дня (1965)] [омонимия не снята]"
" иларипыв енипс ан ,етсерк мокснещибдалк", еыртсо ,"кладбищенском кресте, на спине выпирали ", острые , , лопатки.,З. И. Воскресенская. Сердце матери (1963-1965),З. И. Воскресенская,1907,Сердце матери,1963-1965,художественная,повесть,_,,,книга,омонимия не снята,"Длинный, грязный армяк болтался на худом теле, как на кладбищенском кресте, на спине выпирали острые лопатки. [З. И. Воскресенская. Сердце матери (1963-1965)] [омонимия не снята]"
" еикьнелам келвзи я ,енамрак в", еыртсо ,"в кармане, я извлек маленькие ", острые , ," клещи и, выразительно пощелкивая ими,","Аркадий Стругацкий, Борис Стругацкий. Понедельник начинается в субботу (1964)","Аркадий Стругацкий, Борис Стругацкий",1925 | 1933,Понедельник начинается в субботу,1964,художественная,роман,_,,,книга,омонимия не снята,"Пошарив в кармане, я извлек маленькие острые клещи и, выразительно пощелкивая ими, стал приближаться к дублю. [Аркадий Стругацкий, Борис Стругацкий. Понедельник начинается в субботу (1964)] [омонимия не снята]"
" хищюяледзар ,нибжол йоктес йотсуг еыннечесереп", еыртсо ,"пересеченные густой сеткой ложбин, разделяющих ", острые , ," гребни и выступы, безрадостные пространства.","П. Каплин. В водах Адриатического моря // «Спортсмен-подводник», 1964",П. Каплин,,В водах Адриатического моря,1964,"нехудожественная, публицистика",статья,"природа, путешествия, спорт",«Спортсмен-подводник»,1964,журнал,омонимия не снята,"Это ― выжженные, лишенные воды и растительности, пересеченные густой сеткой ложбин, разделяющих острые гребни и выступы, безрадостные пространства. [П. Каплин. В водах Адриатического моря // «Спортсмен-подводник», 1964] [омонимия не снята]"
 и имадзороб имикобулг и имикзу, имыртсо ,узкими и глубокими бороздами и , острыми , ," гребнями поверхность, по которой пройти,","П. Каплин. В водах Адриатического моря // «Спортсмен-подводник», 1964",П. Каплин,,В водах Адриатического моря,1964,"нехудожественная, публицистика",статья,"природа, путешествия, спорт",«Спортсмен-подводник»,1964,журнал,омонимия не снята,"Карстовый рельеф начинается выше уровня моря, где вместо пляжа изуродованная узкими и глубокими бороздами и острыми гребнями поверхность, по которой пройти, не сломав ногу, можно только при известной сноровке. [П. Каплин. В водах Адриатического моря // «Спортсмен-подводник», 1964] [омонимия не снята]"
 яслижуроов йачулс йикясв ан и, мыртсо ,и на всякий случай вооружился , острым , , кинжалом.,А. М. Волков. Урфин Джюс и его деревянные солдаты (1963),А. М. Волков,1891,Урфин Джюс и его деревянные солдаты,1963,художественная,сказка,_,,,книга,омонимия не снята,приказал наместник и на всякий случай вооружился острым кинжалом. [А. М. Волков. Урфин Джюс и его деревянные солдаты (1963)] [омонимия не снята]
 екур в и анамйоп ежу, йыртсо ,уже поймана и в руке , острый , , нож.,"В. Орлов. Как я стал подводным охотником (Исповедь, содержащая ряд практических советов) // «Спортсмен-подводник», 1963",В. Орлов,,"Как я стал подводным охотником (Исповедь, содержащая ряд практических советов)",1963,"нехудожественная, публицистика",статья,"природа, спорт",«Спортсмен-подводник»,1963,журнал,омонимия не снята,"Мы уже видели, что убить ерша столь же почетно, как зарезать курицу, если она уже поймана и в руке острый нож. [В. Орлов. Как я стал подводным охотником (Исповедь, содержащая ряд практических советов) // «Спортсмен-подводник», 1963] [омонимия не снята]"
