Reversed left context,Reversed center,Left context,Center,Punct,Right context,Title,Author,Birthday,Header,Created,Sphere,Type,Topic,Publication,Publ_year,Medium,Ambiguity,Full context
" етинкторп ,вотог ьсуг отч ,ясьтидебу", мыртсо ,"убедиться, что гусь готов, проткните ", острым , , ножом бедро.,Рецепты национальных кухонь: Скандинавская кухня (2000-2005),,,Рецепты национальных кухонь: Скандинавская кухня,2000-2005,"бытовая, нехудожественная, производственно-техническая",рецепт,дом и домашнее хозяйство,,,электронный текст,омонимия снята,"Для того, чтобы убедиться, что гусь готов, проткните острым ножом бедро. [Рецепты национальных кухонь: Скандинавская кухня (2000-2005)] [омонимия снята]"
 йошьлоб и ― иворк в, йыртсо ,в крови ― и большой , острый , , нож.,Запись LiveJournal (2004),,,Запись LiveJournal,2004,"нехудожественная, электронная коммуникация",блог,частная жизнь,,,электронный текст,омонимия снята,"В руках у безумца ― портфель, в котором лежат четыре предмета: бумажка с адресом Ливии, яблоко, измеритель содержания сахара в крови ― и большой острый нож. [Запись LiveJournal (2004)] [омонимия снята]"
 тюазерорп и укйенил тюавыдалкирп метаЗ, мыртсо ,Затем прикладывают линейку и прорезают , острым , , ножом уложенные внахлест оба полотнища.,"Елена Волкова. Тот самый линолеум // «Биржа плюс свой дом» (Н. Новгород), 2002.08.12",Елена Волкова,,Тот самый линолеум,2002,"нехудожественная, публицистика",статья,дом и домашнее хозяйство,«Биржа плюс свой дом» (Н. Новгород),2002.08.12,газета,омонимия снята,"Затем прикладывают линейку и прорезают острым ножом уложенные внахлест оба полотнища. [Елена Волкова. Тот самый линолеум // «Биржа плюс свой дом» (Н. Новгород), 2002.08.12] [омонимия снята]"
" хынназероп ,хывенчирок хитэ ан лавымердоп", имыртсо ,"подремывал на этих коричневых, порезанных ", острыми , ," ножиками сиденьях, в головах тоже","Андрей Волос. Недвижимость (2000) // «Новый Мир», 2001",Андрей Волос,1955,Недвижимость,2000,художественная,роман,_,«Новый Мир»,2001,журнал,омонимия снята,"Электричка покачивалась, и, наверное, у всех, кто подремывал на этих коричневых, порезанных острыми ножиками сиденьях, в головах тоже мелькали какие-то картинки, ― может быть, чем-то похожие на мои, ― да только никому здесь не было дела до того, что в голове у другого. [Андрей Волос. Недвижимость (2000) // «Новый Мир», 2001] [омонимия снята]"
 ёе илырку ино адог авд, еыртсо ,два года они укрыли её , острые , , лопатки.,"Людмила Улицкая. Казус Кукоцкого [Путешествие в седьмую сторону света] // «Новый Мир», 2000",Людмила Улицкая,1943,Казус Кукоцкого [Путешествие в седьмую сторону света],2000,художественная,роман,_,«Новый Мир»,2000,журнал,омонимия снята,"Теперь Таня носила короткие чёрные платья и длинные коричневые волосы, росшие с удивительной скоростью: за два года они укрыли её острые лопатки. [Людмила Улицкая. Казус Кукоцкого [Путешествие в седьмую сторону света] // «Новый Мир», 2000] [омонимия снята]"
" с ,яаннечосыВ", имыртсо ,"Высоченная, с ", острыми , , пиками поверху железная огорожа была,Борис Екимов. Пиночет (1999),Борис Екимов,1938,Пиночет,1999,художественная,повесть,_,,,книга,омонимия снята,"Высоченная, с острыми пиками поверху железная огорожа была там и здесь целыми пролётами повалена и вдавлена колёсами в землю. [Борис Екимов. Пиночет (1999)] [омонимия снята]"
 и имазалг имынмузеб с акеволеч, мыртсо ,человека с безумными глазами и , острым , , ножом в руках.,Григорий Горин. Иронические мемуары (1990-1998),Григорий Горин,1940,Иронические мемуары,1990-1998,художественная,мемуары,_,,,книга,омонимия снята,Только тут все замечают за спиной артиста хохочущего человека с безумными глазами и острым ножом в руках. [Григорий Горин. Иронические мемуары (1990-1998)] [омонимия снята]
",кос йынневкюлк ил ывотог :еелаД", йыртсо ,"Далее: готовы ли клюквенный сок,", острый , ," нож, штопор для выковыривания глаз, шило","Людмила Петрушевская. Маленькая волшебница // «Октябрь», 1996",Людмила Петрушевская,1938,Маленькая волшебница,1996,художественная,роман,_,«Октябрь»,1996,журнал,омонимия снята,"Далее: готовы ли клюквенный сок,острый нож, штопор для выковыривания глаз, шило для ушей?  [Людмила Петрушевская. Маленькая волшебница // «Октябрь», 1996] [омонимия снята]"
" латсод ,кюрк ан лисевдоп ,)ондзоп", йыртсо ,"поздно), подвесил на крюк, достал ", острый , ," нож, зажмурился и вонзил нож",Алексей Слаповский. Гибель гитариста (1994-1995),Алексей Слаповский,1957,Гибель гитариста,1994-1995,художественная,повесть,_,,,книга,омонимия снята,"Он связал ему лапы ( котёнок сперва был доверчив, потом стал дёргаться ― но поздно), подвесил на крюк, достал острый нож, зажмурился и вонзил нож в котёнка. [Алексей Слаповский. Гибель гитариста (1994-1995)] [омонимия снята]"
 ытфок доп-зи тенатсод ано адгот, йыртсо ,тогда она достанет из-под кофты , острый , , нож…,Алексей Слаповский. Гибель гитариста (1994-1995),Алексей Слаповский,1957,Гибель гитариста,1994-1995,художественная,повесть,_,,,книга,омонимия снята,"Она сегодня на шажок к нему поближе, завтра ещё на шажок ( потому что сразу нет сил, страшно), а когда приблизится совсем близко ( хорошо бы― в комнатке, в прохладе, где чая, однако, нет), тогда она достанет из-под кофты острый нож… [Алексей Слаповский. Гибель гитариста (1994-1995)] [омонимия снята]"
 ноколов ьлодв енидересоп атсем огонткефед, мыртсо ,дефектного места посередине вдоль волокон , острым , , ножом или скальпелем с наклоном,Татьяна Матвеева. Реставрация столярно-мебельных изделий (1988),Татьяна Матвеева,,Реставрация столярно-мебельных изделий,1988,"нехудожественная, учебно-научная",учебное пособие,производство,,,книга,омонимия снята,Вздутия в виде воздушных пузырей устраняют путём надреза дефектного места посередине вдоль волокон острым ножом или скальпелем с наклоном под углом 30… [Татьяна Матвеева. Реставрация столярно-мебельных изделий (1988)] [омонимия снята]
 ан алаворисналаб акшок яарес яаньлачеП, мортсо ,Печальная серая кошка балансировала на , остром , , гребне.,Сергей Довлатов. Заповедник (1983),Сергей Довлатов,1941,Заповедник,1983,художественная,повесть,_,,,книга,омонимия снята,Печальная серая кошка балансировала на остром гребне. [Сергей Довлатов. Заповедник (1983)] [омонимия снята]
",агамуб яалеБ", йыртсо ,"Белая бумага,", острый , , карандаш.,Татьяна Толстая. Ночь (1983),Татьяна Толстая,1951,Ночь,1983,художественная,рассказ,_,,,книга,омонимия снята,"Белая бумага,острый карандаш. [Татьяна Толстая. Ночь (1983)] [омонимия снята]"
" мишьлоб ,уртсок к алшодоп ачлом", мыртсо ,"молча подошла к костру, большим ", острым , ," ножом распластала жирную, чуть не","Марк Сергеев. Волшебная галоша, или Необыкновенные приключения Вадима Смирнова, его лучшего друга Паши Кашкина и 33 невидимок из 117-й (1971)",Марк Сергеев,1926,"Волшебная галоша, или Необыкновенные приключения Вадима Смирнова, его лучшего друга Паши Кашкина и 33 невидимок из 117-й",1971,художественная,повесть,_,,,книга,омонимия снята,"Та, кого старуха назвала Васютой, молча подошла к костру, большим острым ножом распластала жирную, чуть не на килограмм весом рыбину, проткнула её палочками ― рожнами ― и приспособила у огня. [Марк Сергеев. Волшебная галоша, или Необыкновенные приключения Вадима Смирнова, его лучшего друга Паши Кашкина и 33 невидимок из 117-й (1971)] [омонимия снята]"
" яаминдоп ,ажартс яанйовх аляотс йеннёчолпс", еыртсо ,"сплочённей стояла хвойная стража, поднимая ", острые , , пики в небо.,"Александр Солженицын. В круге первом, т.1, гл. 26-51 (1968) // «Новый Мир», 1990",Александр Солженицын,1918,"В круге первом, т.1, гл. 26-51",1968,художественная,роман,_,«Новый Мир»,1990,журнал,омонимия снята,"От её жёлтого нежного огня ещё мрачней и сплочённей стояла хвойная стража, поднимая острые пики в небо. [Александр Солженицын. В круге первом, т.1, гл. 26-51 (1968) // «Новый Мир», 1990] [омонимия снята]"
" и намут йындолох ан ,раф", еыртсо ,"фар, на холодный туман и ", острые , ," пики елей, он словно одеревенел","Василий Аксенов. Пора, мой друг, пора (1963)",Василий Аксенов,1932,"Пора, мой друг, пора",1963,художественная,роман,_,,,книга,омонимия снята,"Марвич бездумным взглядом смотрел на дымный свет фар, на холодный туман и острые пики елей, он словно одеревенел и перестал себя ощущать, но вдруг вздрогнул, почувствовав, что водитель косится. [Василий Аксенов. Пора, мой друг, пора (1963)] [омонимия снята]"
 я ужив И, еыртсо ,И вижу я , острые , ," шашки, и слышу я душу",М. А. Булгаков. Записки покойника (Театральный роман) (1936-1937),М. А. Булгаков,1891,Записки покойника (Театральный роман),1936-1937,художественная,роман,_,,,книга,омонимия снята,"И вижу я острые шашки, и слышу я душу терзающий свист. [М. А. Булгаков. Записки покойника (Театральный роман) (1936-1937)] [омонимия снята]"
" отдуб как ,ьчинзван теадап ,вунхо", мыртсо ,"охнув, падает навзничь, как будто ", острым , , ножом его спереди ударили в,М. А. Булгаков. Записки покойника (Театральный роман) (1936-1937),М. А. Булгаков,1891,Записки покойника (Театральный роман),1936-1937,художественная,роман,_,,,книга,омонимия снята,"Сквозь табачный дым я слежу за ним, я напрягаю зрение и вижу: сверкнуло сзади человека, выстрел, он, охнув, падает навзничь, как будто острым ножом его спереди ударили в сердце. [М. А. Булгаков. Записки покойника (Театральный роман) (1936-1937)] [омонимия снята]"
 лункторп и укшач юунняволо ливатсдоп, мыртсо ,подставил оловянную чашку и проткнул , острым , , скальпелем кожу.,К. Г. Паустовский. Орест Кипренский (1936),К. Г. Паустовский,1892,Орест Кипренский,1936,художественная,рассказ,_,,,книга,омонимия снята,"Риккарди быстро сжал Кипренского за локоть, подставил оловянную чашку и проткнул острым скальпелем кожу. [К. Г. Паустовский. Орест Кипренский (1936)] [омонимия снята]"
 афатсуМ А, йортсо ,А Мустафа , острой , , стамеской кромсает деревянные лохмотья.,Б. С. Житков. Элчан-Кайя (1926),Б. С. Житков,1882,Элчан-Кайя,1926,художественная,рассказ,_,,,книга,омонимия снята,А Мустафа острой стамеской кромсает деревянные лохмотья. [Б. С. Житков. Элчан-Кайя (1926)] [омонимия снята]
" ьтатярп ,итсонйеле йонксупан уксам ябес", йыртсо ,"себя маску напускной елейности, прятать ", острый , , меч и булатную палицу под,"Н. В. Устрялов. К вопросу о русском империализме // «Проблемы России», 1916",Н. В. Устрялов,1890,К вопросу о русском империализме,1916,"нехудожественная, публицистика",статья,политика и общественная жизнь,«Проблемы России»,1916,журнал,омонимия снята,"Неуместно русскому богатырю надевать на себя маску напускной елейности, прятать острый меч и булатную палицу под лохмотья перехожего калики или под рясу чуждого миру монаха № Да, мы здоровая нация, великая и духовно, и физически. [Н. В. Устрялов. К вопросу о русском империализме // «Проблемы России», 1916] [омонимия снята]"
",мылёжят миовс ьзовксан оге лазнорп", мыртсо ,"пронзал его насквозь своим тяжёлым,", острым , , мечом.,Л. А. Чарская. Живая перчатка (1912),Л. А. Чарская,1875,Живая перчатка,1912,художественная,сказка,_,,,книга,омонимия снята,"Стоило кому-либо в недобрый час попасться на его дороге, перейти ему нечаянно путь, и в одно мгновение ока свирепый рыцарь затаптывал насмерть несчастного копытами своего коня или пронзал его насквозь своим тяжёлым,острым мечом. [Л. А. Чарская. Живая перчатка (1912)] [омонимия снята]"
" ьтазердан ,йокум йыннапысоп ,тсил йынзележ", мыртсо ,"железный лист, посыпанный мукой, надрезать ", острым , ," ножом четырехугольные кусочки как лазанки,","Елена Молоховец. Подарок молодым хозяйкам, или средство к уменьшению расходов в домашнем хозяйстве / Колдуны, пельмени, вареники и т. д. (1875-1900)",Елена Молоховец,1835,"Подарок молодым хозяйкам, или средство к уменьшению расходов в домашнем хозяйстве / Колдуны, пельмени, вареники и т. д.",1875-1900,"бытовая, нехудожественная, производственно-техническая",рецепт,дом и домашнее хозяйство,,,книга,омонимия снята,"Замесить крутое тесто, раскатать тонко, сложить на железный лист, посыпанный мукой, надрезать острым ножом четырехугольные кусочки как лазанки, вставить в печь, чтобы подрумянились и подсохли. [Елена Молоховец. Подарок молодым хозяйкам, или средство к уменьшению расходов в домашнем хозяйстве / Колдуны, пельмени, вареники и т. д. (1875-1900)] [омонимия снята]"
 или еквокниш в имакитмол ястюукниш, мыртсо ,шинкуются ломтиками в шинковке или , острым , , ножом.,"Елена Молоховец. Подарок молодым хозяйкам, или средство к уменьшению расходов в домашнем хозяйстве / Перечень разнородных правил при приг (1875-1900)",Елена Молоховец,1835,"Подарок молодым хозяйкам, или средство к уменьшению расходов в домашнем хозяйстве / Перечень разнородных правил при приг",1875-1900,"бытовая, нехудожественная, производственно-техническая",рецепт,дом и домашнее хозяйство,,,книга,омонимия снята,"Свежие огурцы для салата очищаются ножом от кожицы, и затем шинкуются ломтиками в шинковке или острым ножом. [Елена Молоховец. Подарок молодым хозяйкам, или средство к уменьшению расходов в домашнем хозяйстве / Перечень разнородных правил при приг (1875-1900)] [омонимия снята]"
",урдец юукьнетлёж юумас окнот ьнечо", мыртсо ,"очень тонко самую жёлтенькую цедру,", острым , ," ножом, кругом лимона, вскипятить её","Елена Молоховец. Подарок молодым хозяйкам, или средство к уменьшению расходов в домашнем хозяйстве / Перечень разнородных правил при приг (1875-1900)",Елена Молоховец,1835,"Подарок молодым хозяйкам, или средство к уменьшению расходов в домашнем хозяйстве / Перечень разнородных правил при приг",1875-1900,"бытовая, нехудожественная, производственно-техническая",рецепт,дом и домашнее хозяйство,,,книга,омонимия снята,"Обварить, обтереть его чистым полотенцем, срезать очень тонко самую жёлтенькую цедру,острым ножом, кругом лимона, вскипятить её с водой или сиропом, приготовленным для желе лимонного, для киселя, сабайона, варенья и пр. и затем вынуть её. [Елена Молоховец. Подарок молодым хозяйкам, или средство к уменьшению расходов в домашнем хозяйстве / Перечень разнородных правил при приг (1875-1900)] [омонимия снята]"
 мымас ьтазерзар ;уклуб юувтсрёч адгесв, мыртсо ,всегда чёрствую булку; разрезать самым , острым , , ножом.,"Елена Молоховец. Подарок молодым хозяйкам, или средство к уменьшению расходов в домашнем хозяйстве / Перечень разнородных правил при приг (1875-1900)",Елена Молоховец,1835,"Подарок молодым хозяйкам, или средство к уменьшению расходов в домашнем хозяйстве / Перечень разнородных правил при приг",1875-1900,"бытовая, нехудожественная, производственно-техническая",рецепт,дом и домашнее хозяйство,,,книга,омонимия снята,"Для греночек и гренок надо брать всегда чёрствую булку; разрезать самым острым ножом. [Елена Молоховец. Подарок молодым хозяйкам, или средство к уменьшению расходов в домашнем хозяйстве / Перечень разнородных правил при приг (1875-1900)] [омонимия снята]"
