Reversed left context,Reversed center,Left context,Center,Punct,Right context,Title,Author,Birthday,Header,Created,Sphere,Type,Topic,Publication,Publ_year,Medium,Ambiguity,Full context
.имин дан ьсилижурк ихум еинис, йыртсО ,синие мухи кружились над ними., Острый , , запах навоза стоял на улице.,А. И. Мусатов. Большая весна (1957),А. И. Мусатов,1911,Большая весна,1957,художественная,повесть,_,,,книга,омонимия не снята,синие мухи кружились над ними. Острый запах навоза стоял на улице. [А. И. Мусатов. Большая весна (1957)] [омонимия не снята]
хи лахыдв чивеескелА йиртимД, йыртсо ,Дмитрий Алексеевич вдыхал их, острый , ," запах, напоминающий каждому о лучших",Владимир Дудинцев. Не хлебом единым (1956),Владимир Дудинцев,1918,Не хлебом единым,1956,художественная,роман,_,,,книга,омонимия не снята,"Дмитрий Алексеевич вдыхал ихострый запах, напоминающий каждому о лучших минутах жизни. [Владимир Дудинцев. Не хлебом единым (1956)] [омонимия не снята]"
"оге ,низнеб лыб отэ ―", йыртсо ,"― это был бензин, его", острый , , запах! ,Владимир Дудинцев. Не хлебом единым (1956),Владимир Дудинцев,1918,Не хлебом единым,1956,художественная,роман,_,,,книга,омонимия не снята,"И не успел Дмитрий Алексеевич сообразить, о какой выпивке идет речь, как Евгений Устинович, решительно нахмурясь, тряся пузырьком, облил весь стол бензином ― это был бензин, егоострый запах!  [Владимир Дудинцев. Не хлебом единым (1956)] [омонимия не снята]"
"он ,йыбалс лираду уме сон", йыртсо ,"нос ему ударил слабый, но", острый , ," запах дегтя, лошади, табака и",Юрий Казаков. Тэдди (1956),Юрий Казаков,1927,Тэдди,1956,художественная,рассказ,_,,,книга,омонимия не снята,"Улегшаяся было шерсть на загривке тотчас поднялась: в нос ему ударил слабый, ноострый запах дегтя, лошади, табака и людей. [Юрий Казаков. Тэдди (1956)] [омонимия не снята]"
оньловод хищюадзи и манетс оп, йыртсо ,по стенам и издающих довольно, острый , , запах.,А. Н. Бенуа. Жизнь художника (1955),А. Н. Бенуа,1870,Жизнь художника,1955,"нехудожественная, публицистика",мемуары,частная жизнь,,,книга,омонимия не снята,"Зрительный зал представляет собою огромный, обитый досками сарай, освещенный рядом тусклых керосиновых ламп, повешенных по стенам и издающих довольноострый запах. [А. Н. Бенуа. Жизнь художника (1955)] [омонимия не снята]"
"он ,иминьлад еелоб с ьсяавишемс", имыртсо ,"смешиваясь с более дальними, но", острыми , ," запахами леса, и этот легкий",Юрий Казаков. Тихое утро (1954),Юрий Казаков,1927,Тихое утро,1954,художественная,рассказ,_,,,книга,омонимия не снята,"И запахи эти, смешиваясь с более дальними, ноострыми запахами леса, и этот легкий теплый ветер были похожи на дыхание проснувшейся земли, радующейся новому светлому дню. [Юрий Казаков. Тихое утро (1954)] [омонимия не снята]"
",еыбосо И", еыртсо ,"И особые,", острые , ," запахи ресторанной кухни, смешанные с",А. И. Пантелеев. Ленька Пантелеев (1938-1952),А. И. Пантелеев,1908,Ленька Пантелеев,1938-1952,художественная,повесть,_,,,книга,омонимия не снята,"И особые,острые запахи ресторанной кухни, смешанные с запахами сигар и винного перегара. [А. И. Пантелеев. Ленька Пантелеев (1938-1952)] [омонимия не снята]"
лираду уме сон В, йыртсо ,В нос ему ударил, острый , , запах духов.,А. И. Пантелеев. Ленька Пантелеев (1938-1952),А. И. Пантелеев,1908,Ленька Пантелеев,1938-1952,художественная,повесть,_,,,книга,омонимия не снята,В нос ему ударилострый запах духов. [А. И. Пантелеев. Ленька Пантелеев (1938-1952)] [омонимия не снята]
".икйок ин ,ран ин олыб", йыртсО ,"было ни нар, ни койки.", Острый , , запах исходил из параши в,А. А. Фадеев. Молодая гвардия (1943-1951),А. А. Фадеев,1901,Молодая гвардия,1943-1951,художественная,роман,_,,,книга,омонимия не снята,"было ни нар, ни койки. Острый запах исходил из параши в углу. [А. А. Фадеев. Молодая гвардия (1943-1951)] [омонимия не снята]"
.ацитупсар алапутсан яитыркто ее юнд, еыртсО ,дню ее открытия наступала распутица., Острые , , запахи ярмарочных товаров были слышны,К. Г. Паустовский. Книга о жизни. Далекие годы (1946),К. Г. Паустовский,1892,Книга о жизни. Далекие годы,1946,художественная,роман,_,,,книга,омонимия не снята,дню ее открытия наступала распутица. Острые запахи ярмарочных товаров были слышны издалека. [К. Г. Паустовский. Книга о жизни. Далекие годы (1946)] [омонимия не снята]
;угенс ан тяпиш ― ызьлиг, йыртсо ,гильзы ― шипят на снегу;, острый , , запах горелого пороха.,В. В. Вишневский. Дневники военных лет (1943-1945),В. В. Вишневский,1900,Дневники военных лет,1943-1945,"нехудожественная, публицистика","дневник, записные книжки","армия и вооруженные конфликты, искусство и культура",,,книга,омонимия не снята,С дымом вылетают горячие гильзы ― шипят на снегу;острый запах горелого пороха. [В. В. Вишневский. Дневники военных лет (1943-1945)] [омонимия не снята]
.ехичензуК к зинв яслаксупс я, йыртсО ,я спускался вниз к Кузнечихе., Острый , , запах соснового бора стоял над,Вениамин Каверин. Два капитана (1938-1944),Вениамин Каверин,1902,Два капитана,1938-1944,художественная,роман,_,,,книга,омонимия не снята,"я спускался вниз к Кузнечихе. Острый запах соснового бора стоял над рекой; мост был разведен; маленький пароходик, огибая бесконечные плоты, возил народ к пристани от пролета. [Вениамин Каверин. Два капитана (1938-1944)] [омонимия не снята]"
"с теавызакссар ,екволешым в укшым", мыртсо ,"мышку в мышеловке, рассказывает с", острым , , душком ненавистничества благочестивую легенду о,А. К. Дживелегов. Джеффри Чосер (1943),А. К. Дживелегов,1875,Джеффри Чосер,1943,"нехудожественная, учебно-научная",статья,"наука и технологии, филология",,,книга,омонимия не снята,"Но когда настоятельница, дама с нежным сердцем, носившая на браслетке девиз: « Amor vincit omnia» ( любовь побеждает все), оплакивавшая каждую наказанную собачку и каждую мышку в мышеловке, рассказывает сострым душком ненавистничества благочестивую легенду о ребенке, якобы замученном евреями, ― это имеет особый смысл. [А. К. Дживелегов. Джеффри Чосер (1943)] [омонимия не снята]"
"― месв дан и ,угенс", йыртсо ,"снегу, и над всем ―", острый , ," запах горячего конского пота, гари",Б. Л. Горбатов. Возвращение (1943),Б. Л. Горбатов,1908,Возвращение,1943,художественная,рассказ,_,,,книга,омонимия не снята,"И, как во сне, ― хутора, пожары, дороги, косматый дым над станицами, кровь и пепел на снегу, и над всем ―острый запах горячего конского пота, гари и дыма, старый, знакомый запах боя. [Б. Л. Горбатов. Возвращение (1943)] [омонимия не снята]"
",йыннартс яссензар етюак оП", йыртсо ,"По каюте разнесся странный,", острый , , запах.,И. А. Ефремов. Встреча над Тускаророй (1942-1943),И. А. Ефремов,1908,Встреча над Тускаророй,1942-1943,художественная,рассказ,_,,,книга,омонимия не снята,"По каюте разнесся странный,острый запах. [И. А. Ефремов. Встреча над Тускаророй (1942-1943)] [омонимия не снята]"
"еищюадзи автсещев ястянарх едг ,иинещемоп", йыртсо ,"помещении, где хранятся вещества издающие", острый , ," запах, некоторые лекарства, краски и","Г. Г. Боссэ. Готовьте из диких весенних растений мучные изделия, супы, салаты (1942)",Г. Г. Боссэ,,"Готовьте из диких весенних растений мучные изделия, супы, салаты",1942,"бытовая, нехудожественная",совет,"дом и домашнее хозяйство, здоровье и медицина",,,прочая печатная продукция,омонимия не снята,"Поэтому его нельзя держать в помещении, где хранятся вещества издающиеострый запах, некоторые лекарства, краски и т. д. [Г. Г. Боссэ. Готовьте из диких весенних растений мучные изделия, супы, салаты (1942)] [омонимия не снята]"
",йонротирп -овилшуду ьтишулгаз гом ен", йортсо ,"не мог заглушить удушливо- приторной,", острой , , вони разлагающихся трупов.,М. А. Шолохов. Наука ненависти (1942),М. А. Шолохов,1905,Наука ненависти,1942,"нехудожественная, публицистика",_,_,,,книга,омонимия не снята,"Под поверженными стволами сосен лежали мертвые немецкие солдаты, в зеленом папоротнике гнили их изорванные в клочья тела, и смолистый аромат расщепленных снарядами сосен не мог заглушить удушливо- приторной,острой вони разлагающихся трупов. [М. А. Шолохов. Наука ненависти (1942)] [омонимия не снята]"
то тиншот итчоп янем он, огортсо ,но меня почти тошнит от, острого , , запаха гноя.,Ю. М. Нагибин. Волховская тетрадь (1942),Ю. М. Нагибин,1920,Волховская тетрадь,1942,"нехудожественная, публицистика","дневник, записные книжки",_,,,книга,омонимия не снята,"Что вы пустяки говорите, ― отвечаю я, но меня почти тошнит отострого запаха гноя. [Ю. М. Нагибин. Волховская тетрадь (1942)] [омонимия не снята]"
"худзов тюянлопан иилонгам еищюахуогалб ,йовтсил", мыртсо ,"листвой, благоухающие магнолии наполняют воздух", острым , ," запахом белых цветов, золотисто- желтые",А. Е. Ферсман. Воспоминания о камне (1940),А. Е. Ферсман,1883,Воспоминания о камне,1940,"нехудожественная, публицистика","очерк, цикл","геология, наука и технологии",,,книга,омонимия не снята,"Уже вытягиваются к небу громадные эвкалипты с их нежной листвой, благоухающие магнолии наполняют воздухострым запахом белых цветов, золотисто- желтые цветы мимозы приносят в марте первое весеннее приветствие из Колхиды на снежные улицы Москвы. [А. Е. Ферсман. Воспоминания о камне (1940)] [омонимия не снята]"
.абелх зеб ― кат отсорп, йыртсО ,просто так ― без хлеба., Острый , , запах чеснока щекотал нам ноздри.,В. П. Беляев. Старая крепость (1937-1940),В. П. Беляев,1909,Старая крепость,1937-1940,художественная,роман,_,,,книга,омонимия не снята,колбасу просто так ― без хлеба. Острый запах чеснока щекотал нам ноздри. [В. П. Беляев. Старая крепость (1937-1940)] [омонимия не снята]
.ьсилавиемсоп ырецифО, йыртсО ,Офицеры посмеивались., Острый , , душок недалекой опасности сближал их,М. А. Шолохов. Тихий Дон. Книга первая (1928-1940),М. А. Шолохов,1905,Тихий Дон. Книга первая,1928-1940,художественная,роман,_,,,книга,омонимия не снята,"Офицеры посмеивались. Острый душок недалекой опасности сближал их с солдатами, делал снисходительней. [М. А. Шолохов. Тихий Дон. Книга первая (1928-1940)] [омонимия не снята]"
"либ уме ирдзон в ,янок", йыртсо ,"коня, в ноздри ему бил", острый , , запах конского пота.,М. А. Шолохов. Тихий Дон. Книга первая (1928-1940),М. А. Шолохов,1905,Тихий Дон. Книга первая,1928-1940,художественная,роман,_,,,книга,омонимия не снята,"Свист перелетавших пуль заставлял его клонить голову к мокрой шее коня, в ноздри ему билострый запах конского пота. [М. А. Шолохов. Тихий Дон. Книга первая (1928-1940)] [омонимия не снята]"
",вороткод и ретсес ацил еишвичуксан", йыртсо ,"наскучившие лица сестер и докторов,", острый , ," запах йода, карболки…",М. А. Шолохов. Тихий Дон. Книга третья (1928-1940),М. А. Шолохов,1905,Тихий Дон. Книга третья,1928-1940,художественная,роман,_,,,книга,омонимия не снята,"Перевязки, наскучившие лица сестер и докторов,острый запах йода, карболки… [М. А. Шолохов. Тихий Дон. Книга третья (1928-1940)] [омонимия не снята]"
в ясляровтсар дасомас йытавокьроГ, йортсо ,Горьковатый самосад растворялся в, острой , , вони отсыревших сапог.,М. А. Шолохов. Тихий Дон. Книга третья (1928-1940),М. А. Шолохов,1905,Тихий Дон. Книга третья,1928-1940,художественная,роман,_,,,книга,омонимия не снята,Горьковатый самосад растворялся вострой вони отсыревших сапог. [М. А. Шолохов. Тихий Дон. Книга третья (1928-1940)] [омонимия не снята]
яссенод анагак оД, йыртсо ,До кагана донесся, острый , ," запах лошадиного пота, и налетело",Василий Ян. Чингиз-хан (1939),Василий Ян,1875,Чингиз-хан,1939,художественная,роман,_,,,книга,омонимия не снята,"До кагана донессяострый запах лошадиного пота, и налетело облако пыли, на мгновение скрывшее весь лагерь. [Василий Ян. Чингиз-хан (1939)] [омонимия не снята]"
"яувтсвуч ,меал мывотсиен ьсяавилаз ,ушырк", юуртсо ,"крышу, заливаясь неистовым лаем, чувствуя", острую , , вонь прибывших неведомых людей.,Василий Ян. Чингиз-хан (1939),Василий Ян,1875,Чингиз-хан,1939,художественная,роман,_,,,книга,омонимия не снята,"Одни только желтые узкомордые собаки, с взъерошенною шерстью и красными глазами, яростно прыгали с крыши на крышу, заливаясь неистовым лаем, чувствуяострую вонь прибывших неведомых людей. [Василий Ян. Чингиз-хан (1939)] [омонимия не снята]"
оП, умортсо ,По, острому , ," запаху я сразу узнал, что",П. П. Бажов. Зеленая кобылка (1939),П. П. Бажов,1879,Зеленая кобылка,1939,художественная,рассказ,_,,,книга,омонимия не снята,"Поострому запаху я сразу узнал, что это ржаной хлеб, но все-таки ощупал руками. [П. П. Бажов. Зеленая кобылка (1939)] [омонимия не снята]"
",йоксретиднок в ежад ,ханизагам В", йыртсо ,"В магазинах, даже в кондитерской,", острый , , запах рыбы и соленой воды.,С. Д. Кржижановский. Хорошее море (1937),С. Д. Кржижановский,1887,Хорошее море,1937,"нехудожественная, публицистика",очерк,путешествия,,,книга,омонимия не снята,"В магазинах, даже в кондитерской,острый запах рыбы и соленой воды. [С. Д. Кржижановский. Хорошее море (1937)] [омонимия не снята]"
".адусоп ,ляедо и мшок акпотс", йыртсО ,"стопка кошм и одеял, посуда.", Острый , , запах бараньей шерсти и кумыса,Михаил Ромм. Штурм Пика Сталина (1933-1937),Михаил Ромм,1901,Штурм Пика Сталина,1933-1937,"нехудожественная, публицистика",мемуары,_,,,книга,омонимия не снята,"стопка кошм и одеял, посуда. Острый запах бараньей шерсти и кумыса стоит в воздухе. [Михаил Ромм. Штурм Пика Сталина (1933-1937)] [омонимия не снята]"
лянлопан юньлапс юунметулоП, йыртсо ,Полутемную спальню наполнял, острый , ," запах цветов, идущий из сада.",А. Н. Толстой. Гиперболоид инженера Гарина (1925-1927-1937),А. Н. Толстой,1882,Гиперболоид инженера Гарина,1925-1927-1937,художественная,роман,_,,,книга,омонимия не снята,"Полутемную спальню наполнялострый запах цветов, идущий из сада. [А. Н. Толстой. Гиперболоид инженера Гарина (1925-1927-1937)] [омонимия не снята]"
"ьнечо ,йыбосО", йыртсо ,"Особый, очень", острый , ," запах осоки смешивался со сладкой,",В. П. Катаев. Белеет парус одинокий (1936),В. П. Катаев,1897,Белеет парус одинокий,1936,художественная,повесть,_,,,книга,омонимия не снята,"Особый, оченьострый запах осоки смешивался со сладкой, какой-то ореховой вонью болиголова, от которой действительно начинала болеть голова. [В. П. Катаев. Белеет парус одинокий (1936)] [омонимия не снята]"
ляотс емод В, йыртсо ,В доме стоял, острый , ," запах медикаментов, книг, камфары, необходимой",В. Ф. Ходасевич. Жизнь Василия Травникова (1936),В. Ф. Ходасевич,1886,Жизнь Василия Травникова,1936,художественная,рассказ,_,,,книга,омонимия не снята,"В доме стоялострый запах медикаментов, книг, камфары, необходимой для сохранения бабочек, и ароматического уксуса, кипевшего в маленькой курильнице. [В. Ф. Ходасевич. Жизнь Василия Травникова (1936)] [омонимия не снята]"
олавадто оген тО, мыртсо ,От него отдавало, острым , ," запахом лука и, что сразу",Н. А. Островский. Как закалялась сталь (1930-1934),Н. А. Островский,1904,Как закалялась сталь,1930-1934,художественная,роман,_,,,книга,омонимия не снята,"От него отдавалоострым запахом лука и, что сразу уловил топкий нюх Корчагина, винным перегаром. [Н. А. Островский. Как закалялась сталь (1930-1934)] [омонимия не снята]"
