Reversed left context,Reversed center,Left context,Center,Punct,Right context,Title,Author,Birthday,Header,Created,Sphere,Type,Topic,Publication,Publ_year,Medium,Ambiguity,Full context
 или можон мынжатном ьсетйузьлоп азерзар, имыртсо ,разреза пользуйтесь монтажным ножом или , острыми , , ножницами ,"Neo-Neon Holding: обратная связь с потребителем // «Наружная реклама России», 2003.10.20",,,Neo-Neon Holding: обратная связь с потребителем,2003,"нехудожественная, реклама",статья,производство,«Наружная реклама России»,2003.10.20,журнал,омонимия не снята,"Для разреза пользуйтесь монтажным ножом или острыми ножницами [Neo-Neon Holding: обратная связь с потребителем // «Наружная реклама России», 2003.10.20] [омонимия не снята]"
" еыннесенан ,иинил еыньлатнеманро еынжомзовесв и", мыртсо ,"и всевозможные орнаментальные линии, нанесенные ", острым , ," ножом, параллельные и пересекающиеся в","Знаки весны // «Народное творчество», 2003.08.18",,,Знаки весны,2003,"нехудожественная, публицистика",статья,религия,«Народное творчество»,2003.08.18,журнал,омонимия не снята,"Для передачи оперения в таких фигурках птиц могли использовать и всевозможные орнаментальные линии, нанесенные острым ножом, параллельные и пересекающиеся в виде сетки. [Знаки весны // «Народное творчество», 2003.08.18] [омонимия не снята]"
 ьнечо ясхищюащарв авд и яинеживдереп, хыртсо ,передвижения и два вращающихся очень , острых , , меча превращают человека в очень,"Мьянмарские мечи // «Боевое искусство планеты», 2003.12.08",,,Мьянмарские мечи,2003,"нехудожественная, публицистика",статья,искусство и культура,«Боевое искусство планеты»,2003.12.08,журнал,омонимия не снята,"Низкая позиция, специальная техника передвижения и два вращающихся очень острых меча превращают человека в очень эффективную машину для уничтожения себе подобных. [Мьянмарские мечи // «Боевое искусство планеты», 2003.12.08] [омонимия не снята]"
" тюатсарыв ,илмез доп-зи онволс ,еднамок", еыртсо ,"команде, словно из-под земли, вырастают ", острые , ," иглы, прокалывающие любую покрышку.","Оружие, которое не убивает // «Солдат удачи», 2003.12.03",,,"Оружие, которое не убивает",2003,"нехудожественная, публицистика",статья,техника,«Солдат удачи»,2003.12.03,журнал,омонимия не снята,"Как только возникает необходимость остановить тот или иной автомобиль, по команде, словно из-под земли, вырастают острые иглы, прокалывающие любую покрышку. [Оружие, которое не убивает // «Солдат удачи», 2003.12.03] [омонимия не снята]"
( арубодел кобирг ан оньлис, еыртсо ,сильно на грибок ледобура (, острые , , ножи довольно легко входят в,"Особенности зимней любительской ловли // «Рыбак Приморья», 2003.01.30",,,Особенности зимней любительской ловли,2003,"нехудожественная, публицистика",статья,производство,«Рыбак Приморья»,2003.01.30,газета,омонимия не снята,"При сверлении лунки не нажимайте сильно на грибок ледобура (острые ножи довольно легко входят в лед), следя в то же время, чтобы штанга ледобура все время находилась в вертикальном положении. [Особенности зимней любительской ловли // «Рыбак Приморья», 2003.01.30] [омонимия не снята]"
" или меивзел тюазердан онтарукка ,келешок", мыртсо ,"кошелек, аккуратно надрезают лезвием или ", острым , , ножиком и через возникшую прорезь,"Потрошители сумок воруют кошельки // «Встреча» (Дубна), 2003.04.16",,,Потрошители сумок воруют кошельки,2003,"нехудожественная, публицистика",заметка,криминал,«Встреча» (Дубна),2003.04.16,газета,омонимия не снята,"Пока увлеченный витриной покупатель разглядывает товар и цены, его хозяйственную сумку ( или полиэтиленовый пакет), где предположительно лежит кошелек, аккуратно надрезают лезвием или острым ножиком и через возникшую прорезь тихонько выгребают искомое. [Потрошители сумок воруют кошельки // «Встреча» (Дубна), 2003.04.16] [омонимия не снята]"
" ,моклеток микновз ,моказкюр с етсемв", мыртсо ,"вместе с рюкзаком, звонким котелком, ", острым , , топором и удочками…,Дмитрий Каралис. Раки (2002-2003),Дмитрий Каралис,1949,Раки,2002-2003,художественная,рассказ,_,,,электронный текст,омонимия не снята,"Сделав несколько попыток выпрыгнуть из воды и лечь на спинку кормы животом, дядя Жора вопреки окрикам отца попробовал проникнуть в лодку с борта ― именно такая позиция, как совершенно негодная, перечеркнута красным крестом на плакатах по правилам поведения на воде ― и чуть не перевернул нас вместе с рюкзаком, звонким котелком, острым топором и удочками… [Дмитрий Каралис. Раки (2002-2003)] [омонимия не снята]"
 с етсемВ, йортсо ,Вместе с , острой , , саблей ,Людмила Гурченко. Аплодисменты (1994-2003),Людмила Гурченко,1935,Аплодисменты,1994-2003,"нехудожественная, публицистика",мемуары,_,,,книга,омонимия не снята,Вместе с острой саблей [Людмила Гурченко. Аплодисменты (1994-2003)] [омонимия не снята]
" с ,атсевен А", йортсо ,"А невеста, с ", острой , ," саблей и пикой, ждет дома",Людмила Гурченко. Аплодисменты (1994-2003),Людмила Гурченко,1935,Аплодисменты,1994-2003,"нехудожественная, публицистика",мемуары,_,,,книга,омонимия не снята,"А невеста, с острой саблей и пикой, ждет дома жениха с войны. [Людмила Гурченко. Аплодисменты (1994-2003)] [омонимия не снята]"
 йымас оН, йыртсо ,Но самый , острый , , пик кризиса мы пока не,"Александр Кривцов. Тенгиз Китовани: «В Панкиси не менее 1800 боевиков» // «Известия», 2002.09.16",Александр Кривцов,,Тенгиз Китовани: «В Панкиси не менее 1800 боевиков»,2002,"нехудожественная, публицистика",интервью,политика и общественная жизнь,«Известия»,2002.09.16,газета,омонимия не снята,"Но самый острый пик кризиса мы пока не прошли. [Александр Кривцов. Тенгиз Китовани: «В Панкиси не менее 1800 боевиков» // «Известия», 2002.09.16] [омонимия не снята]"
" мотэ ирп яазердоп иксечидоиреп ,онвендеже", мыртсо ,"ежедневно, периодически подрезая при этом ", острым , ," ножом нижнюю часть стебля, который","Анатолий Савченко. Радость моя - тюльпаны // «Homes & Gardens», 2002.04.15",Анатолий Савченко,,Радость моя - тюльпаны,2002,"нехудожественная, публицистика",статья,природа,«Homes & Gardens»,2002.04.15,журнал,омонимия не снята,"Менять ее надо ежедневно, периодически подрезая при этом острым ножом нижнюю часть стебля, который все еще продолжает удлиняться в воде. [Анатолий Савченко. Радость моя - тюльпаны // «Homes & Gardens», 2002.04.15] [омонимия не снята]"
" йыннеортсыв ,ториш хишан ялд йынчывирпен", имыртсо ,"непривычный для наших широт, выстроенный ", острыми , , пиками лиственниц силуэт леса.,"Василий Голованов. Остров, или оправдание бессмысленных путешествий (2002)",Василий Голованов,1960,"Остров, или оправдание бессмысленных путешествий",2002,"нехудожественная, публицистика",монография,путешествия,,,книга,омонимия не снята,"Была прекрасная погода, голубое небо, контрастный « мартовский» северный свет, озаренные этим светом « пески» на окраине города, бараки, пятиэтажки, непривычный для наших широт, выстроенный острыми пиками лиственниц силуэт леса. [Василий Голованов. Остров, или оправдание бессмысленных путешествий (2002)] [омонимия не снята]"
" ,мецнлос йотерган ,екнибжол в тидис", мыртсо ,"сидит в ложбинке, нагретой солнцем, ", острым , , ножом выкапывая золотой корень.,"Василий Голованов. Остров, или оправдание бессмысленных путешествий (2002)",Василий Голованов,1960,"Остров, или оправдание бессмысленных путешествий",2002,"нехудожественная, публицистика",монография,путешествия,,,книга,омонимия не снята,"На берегу, где река сходится с морем, он сидит в ложбинке, нагретой солнцем, острым ножом выкапывая золотой корень. [Василий Голованов. Остров, или оправдание бессмысленных путешествий (2002)] [омонимия не снята]"
" микьнелам нидо а ,тажред оревтеЧ", мыртсо ,"Четверо держат, а один маленьким ", острым , , ножом делает ему надрез в,"Василий Голованов. Остров, или оправдание бессмысленных путешествий (2002)",Василий Голованов,1960,"Остров, или оправдание бессмысленных путешествий",2002,"нехудожественная, публицистика",монография,путешествия,,,книга,омонимия не снята,"Четверо держат, а один маленьким острым ножом делает ему надрез в паху, извлекает из мошонки два белых, абсолютно правильной эллипсовидной формы яичка, перекручивает их, чем-то еще перетягивает ― и одним махом отрезает. [Василий Голованов. Остров, или оправдание бессмысленных путешествий (2002)] [омонимия не снята]"
" с аквотнив ,игопас ,мен ан", мыртсо ,"на нем, сапоги, винтовка с ", острым , ," штыком, сабля на поясе.","Василий Голованов. Остров, или оправдание бессмысленных путешествий (2002)",Василий Голованов,1960,"Остров, или оправдание бессмысленных путешествий",2002,"нехудожественная, публицистика",монография,путешествия,,,книга,омонимия не снята,"Так увидел его Никита: шинель на нем, сапоги, винтовка с острым штыком, сабля на поясе. [Василий Голованов. Остров, или оправдание бессмысленных путешествий (2002)] [омонимия не снята]"
" ,вортилиллим ьтацдавд ан цирпш ,яинавилобзебо", яартсо ,"обезболивания, шприц на двадцать миллилитров, ", острая , ," игла- троакар для прокола кожи,",Влада Валеева. Скорая помощь (2002),Влада Валеева,,Скорая помощь,2002,художественная,роман,_,,,книга,омонимия не снята,"Через минуту готовый стерильный набор для катетеризации центральной вены лежал перед Каплевичем: раствор новокаина для местного обезболивания, шприц на двадцать миллилитров, острая игла- троакар для прокола кожи, длинная полая игла для поиска вены, катетер с проводником и заправленный иглодержатель, чтобы подшить катетер к коже. [Влада Валеева. Скорая помощь (2002)] [омонимия не снята]"
 хынназеререп и ыварт йешвингереп ее, йортсо ,ее перегнившей травы и перерезанных , острой , , лопатой червяков.,"Галина Щербакова. Ангел Мертвого озера // «Новый Мир», 2002",Галина Щербакова,1932,Ангел Мертвого озера,2002,художественная,"рассказ, цикл",_,«Новый Мир»,2002,журнал,омонимия не снята,"Маленький, он был ближе к лунке, к духу ее перегнившей травы и перерезанных острой лопатой червяков. [Галина Щербакова. Ангел Мертвого озера // «Новый Мир», 2002] [омонимия не снята]"
 йыннилд и еще йобос с, йыртсо ,с собой еще и длинный , острый , ," нож- мачете, похожий на саблю,","Михаил Панин. Камикадзе // «Звезда», 2002",Михаил Панин,,Камикадзе,2002,художественная,роман,_,«Звезда»,2002,журнал,омонимия не снята,"Кроме пистолета и бинокля я взял с собой еще и длинный острый нож- мачете, похожий на саблю, который был на спасательном плоту, чтобы отбиваться от акул. [Михаил Панин. Камикадзе // «Звезда», 2002] [омонимия не снята]"
 алилбоксто анО, йортсо ,Она отскоблила , острой , ," бритвой от таблетки несколько крупинок,",Наталья Шмелькова. Последние дни Венедикта Ерофеева (2002),Наталья Шмелькова,,Последние дни Венедикта Ерофеева,2002,"нехудожественная, публицистика",мемуары,_,,,книга,омонимия не снята,"Она отскоблила острой бритвой от таблетки несколько крупинок, приняв которые я утром еле встала. [Наталья Шмелькова. Последние дни Венедикта Ерофеева (2002)] [омонимия не снята]"
.конусир .мс ( еинаводзороб еончерепоП, мыртсО ,Поперечное бороздование ( см. рисунок., Острым , , ножом прорезаем кору.,"Николай Курдюмов. Велю я саду - цвесть! // «Homes & Gardens», 2002.04.15",Николай Курдюмов,,Велю я саду - цвесть!,2002,"нехудожественная, публицистика",статья,природа,«Homes & Gardens»,2002.04.15,журнал,омонимия не снята,"Поперечное бороздование ( см. рисунок. Острым ножом прорезаем кору. [Николай Курдюмов. Велю я саду - цвесть! // «Homes & Gardens», 2002.04.15] [омонимия не снята]"
" тюазерзар отсорп ,оливарп как ,яинетсар", мыртсо ,"растения, как правило, просто разрезают ", острым , ," ножом, и корни при этом","Ольга Собинова. Как угомонить разросшиеся растения // «Homes & Gardens», 2002.07.09",Ольга Собинова,,Как угомонить разросшиеся растения,2002,"нехудожественная, учебно-научная",статья,природа,«Homes & Gardens»,2002.07.09,журнал,омонимия не снята,"В коммерческих питомниках растения, как правило, просто разрезают острым ножом, и корни при этом повреждаются. [Ольга Собинова. Как угомонить разросшиеся растения // «Homes & Gardens», 2002.07.09] [омонимия не снята]"
 юьщомоп с и онжом яинетсар, огортсо ,растения можно и с помощью , острого , ," ножа, однако такая операция способна","Ольга Собинова. Как угомонить разросшиеся растения // «Homes & Gardens», 2002.07.09",Ольга Собинова,,Как угомонить разросшиеся растения,2002,"нехудожественная, учебно-научная",статья,природа,«Homes & Gardens»,2002.07.09,журнал,омонимия не снята,"2. Разделить растения можно и с помощью острого ножа, однако такая операция способна замедлить рост из-за повреждений корневой системы. [Ольга Собинова. Как угомонить разросшиеся растения // «Homes & Gardens», 2002.07.09] [омонимия не снята]"
" имынщязи яанначневу ,адарго яакосыВ", имыртсо ,"Высокая ограда, увенчанная изящными ", острыми , ," пиками, ― и шальная идея","Татьяна Демидова. Металл: изящество и сила // «Homes & Gardens», 2002.05.15",Татьяна Демидова,,Металл: изящество и сила,2002,"нехудожественная, публицистика",статья,строительство и архитектура,«Homes & Gardens»,2002.05.15,журнал,омонимия не снята,"Высокая ограда, увенчанная изящными острыми пиками, ― и шальная идея « выкрасть девчонку вместе с высоким забором» покажется сумасшедшей даже самому отчаянному вору. [Татьяна Демидова. Металл: изящество и сила // «Homes & Gardens», 2002.05.15] [омонимия не снята]"
" ил от ,йовтирб ил от", мыртсо ,"то ли бритвой, то ли ", острым , ," ножом полоснул ему под подбородком,","Эд. Поляновский. Непотопляемый. Этот человек развалил наш футбол, развратил его // «Известия», 2002.07.08",Эд. Поляновский,,"Непотопляемый. Этот человек развалил наш футбол, развратил его",2002,"нехудожественная, публицистика",статья,политика и общественная жизнь,«Известия»,2002.07.08,газета,омонимия не снята,"Славянин сзади чем-то тяжелым ударил журналиста по голове, а кавказец то ли бритвой, то ли острым ножом полоснул ему под подбородком, затем по щеке, через нос по другой щеке. [Эд. Поляновский. Непотопляемый. Этот человек развалил наш футбол, развратил его // «Известия», 2002.07.08] [омонимия не снята]"
.ястедйан хесв ан вокчижоН, ЙЫРТСО ,Ножичков на всех найдется., ОСТРЫЙ , , НОЖ И КРЕПКИЙ ТОПОР ПРИДАЮТ,"Мужское хозяйство: Ножичков на всех найдется // «Автопилот», 2002.06.15",,,Мужское хозяйство: Ножичков на всех найдется,2002,"нехудожественная, публицистика",заметка,дом и домашнее хозяйство,«Автопилот»,2002.06.15,журнал,омонимия не снята,"Ножичков на всех найдется. ОСТРЫЙ НОЖ И КРЕПКИЙ ТОПОР ПРИДАЮТ УВЕРЕННОСТЬ В ЛЮБОЙ СИТУАЦИИ. [Мужское хозяйство: Ножичков на всех найдется // «Автопилот», 2002.06.15] [омонимия не снята]"
" огечин тереб ен ,олед ан", еертсо ,"на дело, не берет ничего ", острее , , расчески.,Владимир Шаров. Воскрешение Лазаря (1997-2002),Владимир Шаров,1952,Воскрешение Лазаря,1997-2002,художественная,роман,_,,,книга,омонимия не снята,"Опытный карманник, чтобы « мусора» не пришили лишнего, идя на дело, не берет ничего острее расчески. [Владимир Шаров. Воскрешение Лазаря (1997-2002)] [омонимия не снята]"
