Reversed left context,Reversed center,Left context,Center,Punct,Right context,Title,Author,Birthday,Header,Created,Sphere,Type,Topic,Publication,Publ_year,Medium,Ambiguity,Full context
" ончот ,ытосарк йоннедйозверпен оцил ,зеторп", мыртсо ,"протез, лицо непревзойденной красоты, точно ", острым , , ножом по смуглому дереву вырезанные,"Татьяна Бек. Люди-кактусы-верблюды, или Думая об Арсении Тарковском (1997) // «Дружба народов», 2003",Татьяна Бек,1949,"Люди-кактусы-верблюды, или Думая об Арсении Тарковском",1997,"нехудожественная, публицистика",мемуары,_,«Дружба народов»,2003,журнал,омонимия не снята,"протез, лицо непревзойденной красоты, точно острым ножом по смуглому дереву вырезанные морщины. [Татьяна Бек. Люди-кактусы-верблюды, или Думая об Арсении Тарковском (1997) // «Дружба народов», 2003] [омонимия не снята]"
 лакыторп тнозирог едг-еоК, йортсо ,Кое-где горизонт протыкал , острой , ," иглой темный костел, либо упрямо","Виктор Астафьев. Веселый солдат (1987-1997) // «Новый Мир», 1998",Виктор Астафьев,1924,Веселый солдат,1987-1997,художественная,рассказ,_,«Новый Мир»,1998,журнал,омонимия не снята,"Кое-где горизонт протыкал острой иглой темный костел, либо упрямо белела и золотилась крестиком подбористая церковка. [Виктор Астафьев. Веселый солдат (1987-1997) // «Новый Мир», 1998] [омонимия не снята]"
 йынморго ил ьшичот ен и, йыртсо ,и не точишь ли огромный , острый , , нож с нехорошим намерением воткнуть,Александра Маринина. Не мешайте палачу (1996),Александра Маринина,1957,Не мешайте палачу,1996,художественная,роман,_,,,книга,омонимия не снята,"Черт с тобой, придется терпеть тебя рядом с диваном, но это и лучше, во всяком случае, я в любой момент смогу видеть тебя, а не прислушиваться к звукам на кухне и не гадать судорожно, чем ты там занимаешься и не точишь ли огромный острый нож с нехорошим намерением воткнуть его мне в глотку». [Александра Маринина. Не мешайте палачу (1996)] [омонимия не снята]"
" ьтсортих отч ,ляноп узарс нО", еертсо ,"Он сразу понял, что хитрость ", острее , ," меча, а цель оправдывает все.",Борис Васильев. Вещий Олег (1996),Борис Васильев,1924,Вещий Олег,1996,художественная,роман,_,,,книга,омонимия не снята,"Он сразу понял, что хитрость острее меча, а цель оправдывает все. [Борис Васильев. Вещий Олег (1996)] [омонимия не снята]"
 ьтсортиХ, еертсо ,Хитрость , острее , ," меча, но то и другое",Борис Васильев. Вещий Олег (1996),Борис Васильев,1924,Вещий Олег,1996,художественная,роман,_,,,книга,омонимия не снята,"Хитрость острее меча, но то и другое притупляется. [Борис Васильев. Вещий Олег (1996)] [омонимия не снята]"
" ьшиЛ 	 ишорох :инмоп ,оН", еыртсо ,"Но, помни: хороши 	 Лишь ", острые , , карандаши.,Валентин Постников. Карандаш и Самоделкин на Северном полюсе (1996),Валентин Постников,1970,Карандаш и Самоделкин на Северном полюсе,1996,художественная,сказка,_,,,книга,омонимия не снята,"Я все могу нарисовать ― 	 Но, помни: хороши 	 Лишь острые карандаши. [Валентин Постников. Карандаш и Самоделкин на Северном полюсе (1996)] [омонимия не снята]"
 янем у хакур итсеш хесв, еыртсо ,всех шести руках у меня , острые , , сабли.,Виктор Пелевин. Чапаев и пустота (1996),Виктор Пелевин,1962,Чапаев и пустота,1996,художественная,роман,_,,,книга,омонимия не снята,"Скажу только, что во всех шести руках у меня острые сабли. [Виктор Пелевин. Чапаев и пустота (1996)] [омонимия не снята]"
 едзе в еыннежярпан ьтедиву алепсу, еыртсо ,успела увидеть напряженные в езде , острые , , лопатки.,Галина Щербакова. Год Алены (1996),Галина Щербакова,1932,Год Алены,1996,художественная,роман,_,,,книга,омонимия не снята,она только успела увидеть напряженные в езде острые лопатки. [Галина Щербакова. Год Алены (1996)] [омонимия не снята]
" с ,тел итявед -имьсов ,етиВ", имыртсо ,"Вите, восьми- девяти лет, с ", острыми , , лопатками и вырезанными гландами.,Галина Щербакова. Год Алены (1996),Галина Щербакова,1932,Год Алены,1996,художественная,роман,_,,,книга,омонимия не снята,"Сейчас Кунины мысли были только об одном ― о мальчике Вите, восьми- девяти лет, с острыми лопатками и вырезанными гландами. [Галина Щербакова. Год Алены (1996)] [омонимия не снята]"
" еомас ― ьтачеп "" а", еортсо ,"а "" печать ― самое ", острое , ," оружие нашей партии"", но все-таки,",Георгий Полонский. Был у меня друг (1996),Георгий Полонский,1939,Был у меня друг,1996,"нехудожественная, публицистика",мемуары,_,,,книга,омонимия не снята,"Нет, ты читай, конечно: "" чтение ― вот лучшее учение"", а "" печать ― самое острое оружие нашей партии"", но все-таки, наряду с почтением, это немного раздражает… [Георгий Полонский. Был у меня друг (1996)] [омонимия не снята]"
" доп ясйещюапол ,йокчорок йовенчирок -отситолоз", мыртсо ,"золотисто- коричневой корочкой, лопающейся под ", острым , ," ножом блестящим от жира разрезом,",Сергей Бабаян. Ротмистр Неженцев (1995-1996),Сергей Бабаян,1958,Ротмистр Неженцев,1995-1996,художественная,роман,_,,,книга,омонимия не снята,"Голод рвал его на части; даже сейчас, когда все тело его, казалось, было поглощено страданием, ― в мозгу волшебными красками расцветали упоительные, пылающие цветами и запахами картины: пышные ломти хлеба, белоснежное сало с красно- фиолетовыми прожилками, дымящиеся розово- крапчатые картофелины ― и, как болезненный удар, предложенный стариком поросенок: уже густо зажаренный, с золотисто- коричневой корочкой, лопающейся под острым ножом блестящим от жира разрезом, ― из которого [Сергей Бабаян. Ротмистр Неженцев (1995-1996)] [омонимия не снята]"
" йыроток ,момуш мысологогонм лажорд колесоп", мыртсо ,"поселок дрожал многоголосым шумом, который ", острым , , ножом резал пронзительный женский крик: ,Сергей Бабаян. Ротмистр Неженцев (1995-1996),Сергей Бабаян,1958,Ротмистр Неженцев,1995-1996,художественная,роман,_,,,книга,омонимия не снята,"Краем глаза Виктор видел бегущих с соседнего двора людей; поселок дрожал многоголосым шумом, который острым ножом резал пронзительный женский крик:  [Сергей Бабаян. Ротмистр Неженцев (1995-1996)] [омонимия не снята]"
" с ылакс еынженсолеб ,гурков ьнемак", имыртсо ,"камень вокруг, белоснежные скалы с ", острыми , ," гребнями, черные, дышащие холодом, провалы",Константин Серафимов. Экспедиция во мрак (1978-1996),Константин Серафимов,1953,Экспедиция во мрак,1978-1996,"нехудожественная, публицистика",монография,спорт,,,книга,омонимия не снята,"Изъеденный, источенный, пробуравленный камень вокруг, белоснежные скалы с острыми гребнями, черные, дышащие холодом, провалы на дне воронок, в их бортах, просто на ровном месте. [Константин Серафимов. Экспедиция во мрак (1978-1996)] [омонимия не снята]"
" ьнечо от-меч анесенан ,яанвор и", мыртсо ,"и ровная, нанесена чем-то очень ", острым , ― , бритвой? ,"Андрей Лазарчук. Все, способные держать оружие... (1995)",Андрей Лазарчук,1958,"Все, способные держать оружие...",1995,художественная,роман,_,,,книга,омонимия не снята,"Рана глубокая и ровная, нанесена чем-то очень острым ― бритвой?  [Андрей Лазарчук. Все, способные держать оружие... (1995)] [омонимия не снята]"
 :еижуро еовокевендерс еонниратс олесив ханетс, еыртсо ,стенах висело старинное средневековое оружие: , острые , ," мечи и сабли, огромные копья",Валентин Постников. Путешествие Карандаша и Самоделкина (1995),Валентин Постников,1970,Путешествие Карандаша и Самоделкина,1995,художественная,сказка,_,,,книга,омонимия не снята,"На стенах висело старинное средневековое оружие: острые мечи и сабли, огромные копья и щиты. [Валентин Постников. Путешествие Карандаша и Самоделкина (1995)] [омонимия не снята]"
" ,йишорох ,ледиву укпярт юунзярг в", йыртсо ,"в грязную тряпку увидел, хороший, ", острый , ," ножик с костяной ручкой, и взмолился:",Виктор Астафьев. Прокляты и убиты. Книга первая. Чертова яма (1995),Виктор Астафьев,1924,Прокляты и убиты. Книга первая. Чертова яма,1995,художественная,роман,_,,,книга,омонимия не снята,"Увидел однажды за сценой Зеленцова, мокрого от пота, вином налитого, прячущего деньги за пояс штанов, под гимнастерку, ножик, завернутый в грязную тряпку увидел, хороший, острый ножик с костяной ручкой, и взмолился:  [Виктор Астафьев. Прокляты и убиты. Книга первая. Чертова яма (1995)] [омонимия не снята]"
" микьнелам йе лизоргоп ,ьсачярп ен", мыртсо ,"не прячась, погрозил ей маленьким ", острым , , ножом.,Ирина Муравьева. Филемон и Бавкида (1995),Ирина Муравьева,1952,Филемон и Бавкида,1995,художественная,повесть,_,,,книга,омонимия не снята,"Э-хе-хе, хе-хе, ― пробормотал он и, уже не прячась, погрозил ей маленьким острым ножом. [Ирина Муравьева. Филемон и Бавкида (1995)] [омонимия не снята]"
 огокьнелам оге еиневонсокирп алавовтсвуч итчоп, огортсо ,почти чувствовала прикосновение его маленького , острого , , ножа с налипшими на нем,Ирина Муравьева. Филемон и Бавкида (1995),Ирина Муравьева,1952,Филемон и Бавкида,1995,художественная,повесть,_,,,книга,омонимия не снята,то ― и это было самое страшное ― она почти чувствовала прикосновение его маленького острого ножа с налипшими на нем волосками… [Ирина Муравьева. Филемон и Бавкида (1995)] [омонимия не снята]
 ьтаминс ястеуднемокер енишрев ее в, мыртсо ,в ее вершине рекомендуется снимать , острым , , зубилом стружку вдоль трещины.,Руководство по эксплуатации строительных конструкций производственных зданий промышленных предприятий (1995),,,Руководство по эксплуатации строительных конструкций производственных зданий промышленных предприятий,1995,"нехудожественная, производственно-техническая",правила,строительство и архитектура,,,книга,омонимия не снята,Для обнаружения окончания трещины в ее вершине рекомендуется снимать острым зубилом стружку вдоль трещины. [Руководство по эксплуатации строительных конструкций производственных зданий промышленных предприятий (1995)] [омонимия не снята]
 ьтиладу омидохбоен воктсачу хыннерутноко нотеБ, мыртсо ,Бетон оконтуренных участков необходимо удалить , острым , ," зубилом до глубины, где он",Руководство по эксплуатации строительных конструкций производственных зданий промышленных предприятий (1995),,,Руководство по эксплуатации строительных конструкций производственных зданий промышленных предприятий,1995,"нехудожественная, производственно-техническая",правила,строительство и архитектура,,,книга,омонимия не снята,"Бетон оконтуренных участков необходимо удалить острым зубилом до глубины, где он не выкрошивается и не издает глухого звука при простукивании молотком. [Руководство по эксплуатации строительных конструкций производственных зданий промышленных предприятий (1995)] [омонимия не снята]"
" илеворп умен оп отдуб ,хазероп", имыртсо ,"порезах, будто по нему провели ", острыми , , граблями.,Александр Кабаков. Последний герой (1994-1995),Александр Кабаков,1943,Последний герой,1994-1995,художественная,роман,_,,,книга,омонимия не снята,"Лицо его было в длинных и ровных косых порезах, будто по нему провели острыми граблями. [Александр Кабаков. Последний герой (1994-1995)] [омонимия не снята]"
 лункьлем нлов ибяр йоклем в, йыртсо ,в мелкой ряби волн мелькнул , острый , , косой плавник.,"В. Лебедев. Путешествие в Золотой век, или наши простаки за границей // «Вокруг света», 1994",В. Лебедев,,"Путешествие в Золотой век, или наши простаки за границей",1994,"нехудожественная, публицистика",статья,путешествия,«Вокруг света»,1994,журнал,омонимия не снята,"Когда утром мы шли на фелюге в море и рыбаки чистили палубу от рыбьей чешуи, мне показалось, что в мелкой ряби волн мелькнул острый косой плавник. [В. Лебедев. Путешествие в Золотой век, или наши простаки за границей // «Вокруг света», 1994] [омонимия не снята]"
" унец огещюанз ,акиннок ялд отэ", йортсо ,"это для конника, знающего цену ", острой , , шашке? ,Г. Н. Владимов. Генерал и его армия (1994),Г. Н. Владимов,1931,Генерал и его армия,1994,художественная,роман,_,,,книга,омонимия не снята,"Много внимания уделял противотанковой обороне, защитным приемам одиночного бойца ― это прекрасно, но какие же у японцев танки, против них рукопашный следует применять, наш излюбленный бой, которого они избегают, а он- то в дивизии Кобрисова был не в почете, и не странно ли это для конника, знающего цену острой шашке?  [Г. Н. Владимов. Генерал и его армия (1994)] [омонимия не снята]"
 ьтсеШ, хыртсо ,Шесть , острых , , копий смотрели ему в грудь.,"Марина Дяченко, Сергей Дяченко. Привратник (1994)","Марина Дяченко, Сергей Дяченко",1945 | 1968,Привратник,1994,художественная,роман,_,,,книга,омонимия не снята,"Шесть острых копий смотрели ему в грудь. [Марина Дяченко, Сергей Дяченко. Привратник (1994)] [омонимия не снята]"
 имикьнелам улкетс оп ляраду от-отк, имыртсо ,кто-то ударял по стеклу маленькими , острыми , , молоточками.,Сергей Бабаян. Господа офицеры (1994),Сергей Бабаян,1958,Господа офицеры,1994,художественная,роман,_,,,книга,омонимия не снята,"Сразу застучали Наташины каблучки, как будто кто-то ударял по стеклу маленькими острыми молоточками. [Сергей Бабаян. Господа офицеры (1994)] [омонимия не снята]"
 с робзар йынйемес ― олед, мыртсо ,дело ― семейный разбор с , острым , ," ножиком, удавкой, солеными рыжичками и",Ю. М. Нагибин. Моя золотая теща (1994),Ю. М. Нагибин,1920,Моя золотая теща,1994,художественная,повесть,_,,,книга,омонимия не снята,"Татьяна Алексеевна была если не из купеческой, то из торговой среды, где привычное дело ― семейный разбор с острым ножиком, удавкой, солеными рыжичками и после поминальных блинов безумные страстные ночи. [Ю. М. Нагибин. Моя золотая теща (1994)] [омонимия не снята]"
 миовс 	 либурс я волог, мыртсо ,голов я срубил 	 своим , острым , ," мечом 	 И, содрав ядовитую",Борис Левин. Инородное тело (1965-1994),Борис Левин,1938,Инородное тело,1965-1994,художественная,повесть,_,,,книга,омонимия не снята,"Семь голов я срубил 	 своим острым мечом 	 И, содрав ядовитую кожу,  	 все засунул в мешок 	 и, взвалив на плечо,  	 Приволок в ее личную ложу. [Борис Левин. Инородное тело (1965-1994)] [омонимия не снята]"
 йыннилд модьлонрА с урутрА лазакоп, йыртсо ,показал Артуру с Арнольдом длинный , острый , ," нож, нехорошо улыбнулся и опять",Виктор Пелевин. Жизнь насекомых (1993),Виктор Пелевин,1962,Жизнь насекомых,1993,художественная,роман,_,,,книга,омонимия не снята,"Через секунду Арчибальд выглянул, показал Артуру с Арнольдом длинный острый нож, нехорошо улыбнулся и опять исчез за дверью. [Виктор Пелевин. Жизнь насекомых (1993)] [омонимия не снята]"
" дан ьсоляндопирп ,моброг ясмищянсол мынреч", имыртсо ,"черным лоснящимся горбом, приподнялось над ", острыми , , гребнями канавы и вдруг обернулось,"Евгений Носов. Темная вода // «Новый мир», 1993",Евгений Носов,1925,Темная вода,1993,художественная,рассказ,_,«Новый мир»,1993,журнал,омонимия не снята,"Должно быть, почуяв постороннее присутствие, это нечто суетно зашевелилось, выпятилось черным лоснящимся горбом, приподнялось над острыми гребнями канавы и вдруг обернулось в нашу сторону. [Евгений Носов. Темная вода // «Новый мир», 1993] [омонимия не снята]"
