Reversed left context,Reversed center,Left context,Center,Punct,Right context,Title,Author,Birthday,Header,Created,Sphere,Type,Topic,Publication,Publ_year,Medium,Ambiguity,Full context
"йищюунлов онтяоревен тидохси адукто ,мосон", йыртсо ,"носом, откуда исходит невероятно волнующий", острый , ," запах шашлыка, который он учуял",Ю. И. Визбор. Завтрак с видом на Эльбрус (1983),Ю. И. Визбор,1934,Завтрак с видом на Эльбрус,1983,художественная,повесть,_,,,книга,омонимия не снята,"И уже кресла с киношниками достигли погруженной в вечернюю тень долины, над которой в голубоватом стальном небе нестерпимо сверкали абсолютно желтые снеговые вершины, уже длинноногий актер спрыгнул с кресла на бетонную палубу нижней станции канатной дороги, опытно определяя большим высокочувствительным носом, откуда исходит невероятно волнующийострый запах шашлыка, который он учуял еще у шестой опоры, как на тебе, вырубился во всем Терсколе свет [Ю. И. Визбор. Завтрак с видом на Эльбрус (1983)] [омонимия не снята]"
йыньлетачемаз тотэ илахыдв И, йыртсо ,И вдыхали этот замечательный, острый , , запах солёных огурцов… А потом,Ирина Пивоварова. Тройка с минусом или происшествие в 5 «А» (1982),Ирина Пивоварова,1939,Тройка с минусом или происшествие в 5 «А»,1982,художественная,повесть,_,,,книга,омонимия не снята,"И вдыхали этот замечательныйострый запах солёных огурцов… А потом Тося купила полстакана жареных семечек, и они стали их грызть, и Алик понемногу снова пришёл в хорошее настроение. [Ирина Пивоварова. Тройка с минусом или происшествие в 5 «А» (1982)] [омонимия не снята]"
лавовтсвучоп Я, йыртсо ,Я почувствовал, острый , , запах канифоли.,Сергей Довлатов. Зона (Записки надзирателя) (1965-1982),Сергей Довлатов,1941,Зона (Записки надзирателя),1965-1982,художественная,рассказ,_,,,книга,омонимия не снята,Я почувствовалострый запах канифоли. [Сергей Довлатов. Зона (Записки надзирателя) (1965-1982)] [омонимия не снята]
",ивтев еикосыв иовс ьседз луниксар", йыртсо ,"раскинул здесь свои высокие ветви,", острый , , запах мешает уснуть.,В. А. Каверин. Верлиока (1981),В. А. Каверин,1902,Верлиока,1981,художественная,сказка,_,,,книга,омонимия не снята,"Гигантский крестовник раскинул здесь свои высокие ветви,острый запах мешает уснуть. [В. А. Каверин. Верлиока (1981)] [омонимия не снята]"
",худзов йызис ,икирк еыняьп ,ималотс", йыртсо ,"столами, пьяные крики, сизый воздух,", острый , , запах дыма и постного масла,В. А. Каверин. Освещенные окна (1974-1976),В. А. Каверин,1902,Освещенные окна,1974-1976,художественная,роман,_,,,книга,омонимия не снята,"Потеряв терпение ( я ждал Борьку на улице), я заглянул в трактир: половые в длинных грязных передниках, носившиеся между столами, пьяные крики, сизый воздух,острый запах дыма и постного масла ошеломили меня. [В. А. Каверин. Освещенные окна (1974-1976)] [омонимия не снята]"
аладжасод ман огесв ешьлоб оН, яартсо ,Но больше всего нам досаждала, острая , ," вонь зверинца, мгновенно пропитавшая всю",Юлия Друнина. Алиска (1973),Юлия Друнина,1924,Алиска,1973,художественная,повесть,_,,,книга,омонимия не снята,"Но больше всего нам досаждалаострая вонь зверинца, мгновенно пропитавшая всю квартиру и даже лестничную клетку. [Юлия Друнина. Алиска (1973)] [омонимия не снята]"
еикгел еищюавылакоп еще в я, йыртсо ,я в еще покалывающие легкие, острый , , запах зверинца.,Юлия Друнина. Алиска (1973),Юлия Друнина,1924,Алиска,1973,художественная,повесть,_,,,книга,омонимия не снята,С волнением втягивала я в еще покалывающие легкиеострый запах зверинца. [Юлия Друнина. Алиска (1973)] [омонимия не снята]
",йылсик едоваз монвреснок аН", йыртсо ,"На консервном заводе кислый,", острый , ," запах въедается в нос, как",Анатолий Кузнецов. Бабий яр (1965-1970),Анатолий Кузнецов,1929,Бабий яр,1965-1970,художественная,роман,_,,,книга,омонимия не снята,"На консервном заводе кислый,острый запах въедается в нос, как ввинчивается. [Анатолий Кузнецов. Бабий яр (1965-1970)] [омонимия не снята]"
",яьпярт огорком и атоп огоксечеволеч", йыртсо ,"человеческого пота и мокрого тряпья,", острый , , запах дезинфекции.,Вадим Кожевников. Щит и меч. Книга первая (1968),Вадим Кожевников,1909,Щит и меч. Книга первая,1968,художественная,роман,_,,,книга,омонимия не снята,"И сразу стали ощутимы кислая вонь тумана, угарный запах человеческого пота и мокрого тряпья,острый запах дезинфекции. [Вадим Кожевников. Щит и меч. Книга первая (1968)] [омонимия не снята]"
ыроп и уджедо в ясйишвеъв, йыртсо ,въевшийся в одежду и поры, острый , , запах взрыва.,К. Я. Ваншенкин. Графин с петухом (1968),К. Я. Ваншенкин,1925,Графин с петухом,1968,художественная,повесть,_,,,книга,омонимия не снята,Долго не исчезал въевшийся в одежду и порыострый запах взрыва. [К. Я. Ваншенкин. Графин с петухом (1968)] [омонимия не снята]
уцдрес оп тенкреч или юьчон, мыртсо ,ночью или черкнет по сердцу, острым , , запахом черемухи…» ,Виль Липатов. Деревенский детектив/ Лосиная кость (1967-1968),Виль Липатов,1927,Деревенский детектив/ Лосиная кость,1967-1968,художественная,рассказ,_,,,книга,омонимия не снята,"Сверкнет солнечным лучом, повеет дождиком, захолонет грудь разбойной ночью или черкнет по сердцуострым запахом черемухи…»  [Виль Липатов. Деревенский детектив/ Лосиная кость (1967-1968)] [омонимия не снята]"
"и мынтяирпен ,асел мохапаз и", мыртсо ,"и запахом леса, неприятным и", острым , ," запахом, который в обычные дни","Аркадий Стругацкий, Борис Стругацкий. Улитка на склоне (1966-1968)","Аркадий Стругацкий, Борис Стругацкий",1925 | 1933,Улитка на склоне,1966-1968,художественная,роман,_,,,книга,омонимия не снята,"Становилось жарко, тянуло влагой и запахом леса, неприятным иострым запахом, который в обычные дни не достигал Управления. [Аркадий Стругацкий, Борис Стругацкий. Улитка на склоне (1966-1968)] [омонимия не снята]"
мынреткарах с овтсещев ― отЭ, мыртсо ,Это ― вещество с характерным, острым , , запахом и слезоточивым раздражающим действием.,"И. Вольпер. Пряности // «Химия и жизнь», 1967",И. Вольпер,,Пряности,1967,"нехудожественная, учебно-научная",статья,"наука и технологии, химия",«Химия и жизнь»,1967,журнал,омонимия не снята,"Когда для приготовления горчицы порошок замешивают с теплой водой, то под влиянием содержащихся в нем ферментов синигрин распадается на глюкозу, бисульфат калия и аллилгорчичное масло, которое почти полностью состоит из аллилизотиоцианата С3Н5 ― N = C = S. Это ― вещество с характернымострым запахом и слезоточивым раздражающим действием. [И. Вольпер. Пряности // «Химия и жизнь», 1967] [омонимия не снята]"
лисонод ретеВ, йыртсо ,Ветер доносил, острый , ," запах водорослей, на губах оседала",Юрий Рытхэу. Время таяния снегов (1967),Юрий Рытхэу,1930,Время таяния снегов,1967,художественная,роман,_,,,книга,омонимия не снята,"Ветер доносилострый запах водорослей, на губах оседала соленая водяная пыль. [Юрий Рытхэу. Время таяния снегов (1967)] [омонимия не снята]"
"с етсемв лаксупыв ,йикстетисревину и", мыртсо ,"и университетский, выпускал вместе с", острым , , запахом восточных блюд очередного посетителя.,Юрий Рытхэу. Время таяния снегов (1967),Юрий Рытхэу,1930,Время таяния снегов,1967,художественная,роман,_,,,книга,омонимия не снята,"Время от времени распахивалась дверь, и швейцар в таких же галунах, как и университетский, выпускал вместе сострым запахом восточных блюд очередного посетителя. [Юрий Рытхэу. Время таяния снегов (1967)] [омонимия не снята]"
.утр ов еще роп хис, йыртсО ,сих пор еще во рту., Острый , ," запах водорослей, рыб, моря и",Рюрик Ивнев. У подножия Мтацминды (1960-1967),Рюрик Ивнев,1891,У подножия Мтацминды,1960-1967,художественная,повесть,_,,,книга,омонимия не снята,"сих пор еще во рту. Острый запах водорослей, рыб, моря и ныне не перестает щекотать мне ноздри. [Рюрик Ивнев. У подножия Мтацминды (1960-1967)] [омонимия не снята]"
как ястеаминирпсов дяраз йыньлетижолоп йошьлоБ, йыртсо ,Большой положительный заряд воспринимается как, острый , ," запах, отрицательный заряд ― как","Р. Подольный. Одно неизвестное и двадцать гипотез... // «Химия и жизнь», 1965",Р. Подольный,,Одно неизвестное и двадцать гипотез...,1965,"нехудожественная, учебно-научная",статья,"наука и технологии, химия",«Химия и жизнь»,1965,журнал,омонимия не снята,"Большой положительный заряд воспринимается какострый запах, отрицательный заряд ― как гнилостный. [Р. Подольный. Одно неизвестное и двадцать гипотез... // «Химия и жизнь», 1965] [омонимия не снята]"
сан литертсв дороГ, мыртсо ,Город встретил нас, острым , ," запахом рыбы, ревом корабельных гудков","В. А. Степанов. 116-й Рейс «Персея» // «Спортсмен-подводник», 1962",В. А. Степанов,,116-й Рейс «Персея»,1962,"нехудожественная, публицистика",статья,"путешествия, спорт",«Спортсмен-подводник»,1962,журнал,омонимия не снята,"Город встретил насострым запахом рыбы, ревом корабельных гудков и слепяще ярким солнцем. [В. А. Степанов. 116-й Рейс «Персея» // «Спортсмен-подводник», 1962] [омонимия не снята]"
, йыртсО ,, Острый , , запах аммиака ошеломил меня.,Владимир Брагин. В стране дремучих трав (1962),Владимир Брагин,1896,В стране дремучих трав,1962,художественная,роман,_,,,книга,омонимия не снята, Острый запах аммиака ошеломил меня. [Владимир Брагин. В стране дремучих трав (1962)] [омонимия не снята]
ясливяоп мотоП, йыртсо ,Потом появился, острый , , запах омытой зелени.,Даниил Гранин. Иду на грозу (1962),Даниил Гранин,1919,Иду на грозу,1962,художественная,роман,_,,,книга,омонимия не снята,Потом появилсяострый запах омытой зелени. [Даниил Гранин. Иду на грозу (1962)] [омонимия не снята]
ирдзон латокещаз йе алачанС, йыртсо ,Сначала ей защекотал ноздри, острый , ," запах мастики, покрывавшей паркетный пол;","Марта Баранова, Евгений Велтистов. Тяпа, Борька и ракета (1962)","Марта Баранова, Евгений Велтистов",1934,"Тяпа, Борька и ракета",1962,художественная,повесть,_,,,книга,омонимия не снята,"Сначала ей защекотал ноздриострый запах мастики, покрывавшей паркетный пол; его перебила теплая приятная волна, вырвавшаяся из кухни; потом Тяпа почувствовала аптеку. [Марта Баранова, Евгений Велтистов. Тяпа, Борька и ракета (1962)] [омонимия не снята]"
"и :оншартс ежад ,ончывирпен ,онтянопен", йыртсо ,"непонятно, непривычно, даже страшно: и", острый , ," запах медикаментов, и странные высокие",Юрий Герман. Дорогой мой человек (1961),Юрий Герман,1910,Дорогой мой человек,1961,художественная,роман,_,,,книга,омонимия не снята,"Все тут было чуждо, непонятно, непривычно, даже страшно: иострый запах медикаментов, и странные высокие носилки на колесах, и яркий свет в белой перевязочной, и длинные равномерные стоны из раскрытой двери в небольшую палату. [Юрий Герман. Дорогой мой человек (1961)] [омонимия не снята]"
",микперк олсен ишут йониревз тО", мыртсо ,"От звериной туши несло крепким,", острым , ," запахом нечистоплотного лесного животного, к",Владимир Тендряков. Суд (1960),Владимир Тендряков,1923,Суд,1960,художественная,повесть,_,,,книга,омонимия не снята,"От звериной туши несло крепким,острым запахом нечистоплотного лесного животного, к нему примешивался неприятно мутящий запах свернувшейся крови. [Владимир Тендряков. Суд (1960)] [омонимия не снята]"
"ее ― ,икйязох то ьсолаватсо", йыртсо ,"оставалось от хозяйки, ― ее", острый , ," запах, ― а затем сорвался",И. Меттер. Мухтар (1960),И. Меттер,1909,Мухтар,1960,художественная,повесть,_,,,книга,омонимия не снята,"Еще мгновение он втягивал ноздрями то, что оставалось от хозяйки, ― ееострый запах, ― а затем сорвался с места, в один прыжок достиг металлической сетки и, ткнувшись в нее носом, тонко заскулил. [И. Меттер. Мухтар (1960)] [омонимия не снята]"
",молуг мынчимтир мынтсоря мынтысанен еыннежароп", мыртсо ,"пораженные ненасытным яростным ритмичным гулом,", острым , , запахом скипидара и сумерками огромного,Юрий Казаков. Северный дневник (1960),Юрий Казаков,1927,Северный дневник,1960,художественная,очерк,_,,,книга,омонимия не снята,"По трапу, по полукруглой дороге, ведущей вверх вдоль транспортеров, поднимаемся и мы во второй этаж, ныряем в низкую фанерную дверцу и останавливаемся со свету, пораженные ненасытным яростным ритмичным гулом,острым запахом скипидара и сумерками огромного помещения. [Юрий Казаков. Северный дневник (1960)] [омонимия не снята]"
"оге с ,вотаказ юьворк йокпил", мыртсо ,"липкой кровью закатов, с его", острым , ," запахом листвы, преследовавшим меня повсюду,",К. Г. Паустовский. Повесть о жизни. Бросок на юг (1959-1960),К. Г. Паустовский,1892,Повесть о жизни. Бросок на юг,1959-1960,художественная,повесть,_,,,книга,омонимия не снята,"Сухум с его великолепными сумерками, тяжелым золотом и липкой кровью закатов, с егоострым запахом листвы, преследовавшим меня повсюду, казался мне городом, оброненным здесь из чужой и не имеющей имени страны. [К. Г. Паустовский. Повесть о жизни. Бросок на юг (1959-1960)] [омонимия не снята]"
"йишвавадзи ,текап йошьлоб ,ынетс йомас", йыртсо ,"самой стены, большой пакет, издававший", острый , ," запах чего-то кислого, испорченного.",А. И. Делианич. Вольфсберг-373 (1945-1960),А. И. Делианич,1909,Вольфсберг-373,1945-1960,"нехудожественная, публицистика",мемуары,"администрация и управление, армия и вооруженные конфликты, криминал, политика и общественная жизнь, религия, трансп",,,книга,омонимия не снята,"Из-под накидки высунулась рука и бросила на мою койку, стоявшую у самой стены, большой пакет, издававшийострый запах чего-то кислого, испорченного. [А. И. Делианич. Вольфсберг-373 (1945-1960)] [омонимия не снята]"
.алес ьртунв ыногорп зереч ретев, йыртсО ,ветер через прогоны внутрь села., Острый , ," запашок пчеловодческого дымаря, разведенного на",В. А. Солоухин. Капля росы (1959),В. А. Солоухин,1924,Капля росы,1959,художественная,повесть,_,,,книга,омонимия не снята,"ветер через прогоны внутрь села. Острый запашок пчеловодческого дымаря, разведенного на сухих белых ивовых гнилушках, может присоединиться уж к медвяному аромату цветущих трав, а вслед за горьким дымком повеет и чистым медом, потому что для того и разводят дымари, чтобы открывать и проверять кипящие пчелами ульи. [В. А. Солоухин. Капля росы (1959)] [омонимия не снята]"
К, умортсо ,К, острому , , запаху крапивы примешается душноватый запах,В. А. Солоухин. Капля росы (1959),В. А. Солоухин,1924,Капля росы,1959,художественная,повесть,_,,,книга,омонимия не снята,"Кострому запаху крапивы примешается душноватый запах таволги, а когда потом, в разгар рыбалки, вы будете невольно хвататься руками, измазанными в земле или рыбе, за растущую вокруг траву, руки ваши надолго пропахнут холодящим запахом мяты. [В. А. Солоухин. Капля росы (1959)] [омонимия не снята]"
илачотси игинК, йыртсо ,Книги источали, острый , , запах лизола и гвоздики.,К. Г. Паустовский. Повесть о жизни. Время больших ожиданий (1958),К. Г. Паустовский,1892,Повесть о жизни. Время больших ожиданий,1958,художественная,роман,_,,,книга,омонимия не снята,Книги источалиострый запах лизола и гвоздики. [К. Г. Паустовский. Повесть о жизни. Время больших ожиданий (1958)] [омонимия не снята]
