Reversed left context,Reversed center,Left context,Center,Punct,Right context,Title,Author,Birthday,Header,Created,Sphere,Type,Topic,Publication,Publ_year,Medium,Ambiguity,Full context
лыб инзиж оге в хапаз, йыртсо ,запах в его жизни был, острый , , запах асидола ― жидкости для,Эдуард Лимонов. У нас была Великая Эпоха (1987),Эдуард Лимонов,1943,У нас была Великая Эпоха,1987,художественная,роман,_,,,книга,омонимия снята,Едва ли не первый запомнившийся сыну Вениамина запах в его жизни былострый запах асидола ― жидкости для чистки пуговиц. [Эдуард Лимонов. У нас была Великая Эпоха (1987)] [омонимия снята]
с ыткудорП, мыртсо ,Продукты с, острым , ," запахом ( сыр, рыба, копчёности,",Инструкция к холодильнику (1980),,,Инструкция к холодильнику,1980,"нехудожественная, производственно-техническая",инструкция,дом и домашнее хозяйство,,,прочая печатная продукция,омонимия снята,"Продукты сострым запахом ( сыр, рыба, копчёности, специи и др.) а также продукты, воспринимающие запахи ( сливочное масло, кремы, творог, сметана и др.), должны храниться в закрытой посуде или упаковке ( в полиэтиленовой плёнке, целлофане, алюминиевой фольге и т. п.). [Инструкция к холодильнику (1980)] [омонимия снята]"
";илокыв залг ьтох ,онмет олыб", йыртсо ,"было темно, хоть глаз выколи;", острый , ," запах дыма свидетельствовал, что лучина",Д. В. Григорович. Бобыль (1847),Д. В. Григорович,1822,Бобыль,1847,художественная,рассказ,_,,,книга,омонимия снята,"Совершенная тишина царствовала повсюду; в избе было темно, хоть глаз выколи;острый запах дыма свидетельствовал, что лучина незадолго угасла. [Д. В. Григорович. Бобыль (1847)] [омонимия снята]"
"и ,осям ястираж ецилу йокзу", йыртсо ,"узкой улице жарится мясо, и", острый , , запах дразнит ноздри.,"Дмитрий Шляпентох. Конец Истории: благословенный Иов // «Сибирские огни», 2013",Дмитрий Шляпентох,1950,Конец Истории: благословенный Иов,2013,художественная,повесть,_,«Сибирские огни»,2013,журнал,омонимия не снята,"На узкой улице жарится мясо, иострый запах дразнит ноздри. [Дмитрий Шляпентох. Конец Истории: благословенный Иов // «Сибирские огни», 2013] [омонимия не снята]"
"ее лашылс ,ееш йокосыв ан", йыртсо ,"на высокой шее, слышал ее", острый , , запах.,"Роман Шмараков. Лошадь // «Сибирские огни», 2013",Роман Шмараков,1971,Лошадь,2013,художественная,рассказ,_,«Сибирские огни»,2013,журнал,омонимия не снята,"В полутьме я видел влажное движенье ее глаз, капли пота на высокой шее, слышал ееострый запах. [Роман Шмараков. Лошадь // «Сибирские огни», 2013] [омонимия не снята]"
"в ,икчодуб ортун еонсет в", йыртсо ,"в тесное нутро будочки, в", острый , ," запах кожи и ваксы, под","Даниил Корецкий. Менты не ангелы, но… (2011)",Даниил Корецкий,1948,"Менты не ангелы, но…",2011,художественная,роман,_,,,книга,омонимия не снята,"Звягинцев втиснулся в тесное нутро будочки, вострый запах кожи и ваксы, под бахрому разноцветных шнурков, надел на себя черный фартук, под руку положил дубинку. [Даниил Корецкий. Менты не ангелы, но… (2011)] [омонимия не снята]"
енсев оп йищянзард ястисоноД, йыртсо ,Доносится дразнящий по весне, острый , ," запах черемши ― видимо, нечаянно",Р. Б. Ахмедов. Промельки (2011),Р. Б. Ахмедов,1933,Промельки,2011,"нехудожественная, публицистика",мемуары,_,,,электронное издание,омонимия не снята,"Доносится дразнящий по веснеострый запах черемши ― видимо, нечаянно наступил на пучок трехгранных стеблей дикого чеснока, готовящегося к цветению. [Р. Б. Ахмедов. Промельки (2011)] [омонимия не снята]"
и яьжур алуд зи комыд, йыртсо ,дымок из дула ружья и, острый , , запах пороховой гари.,"Вацлав Михальский. Река времен. Ave Maria // Октябрь, 2010",Вацлав Михальский,1938,Река времен. Ave Maria,2010,художественная,роман,_,Октябрь,2010,журнал,омонимия не снята,"Вспомнил он, и как с плоской крыши сакли салютовал из охотничьего ружья старый муж роженицы ( наверное, мужу было чуть за тридцать, но тогда он показался двадцатичетырехлетнему Адаму очень старым), вспомнил белый дымок из дула ружья иострый запах пороховой гари. [Вацлав Михальский. Река времен. Ave Maria // Октябрь, 2010] [омонимия не снята]"
",улоп ан кежуртс акроГ", йыртсо ,"Горка стружек на полу,", острый , ," запах липы, в уголке сложены","Ольга Тимофеева. Деревня капиталистического труда // «Русский репортер», № 1-2 (080-081), 22-29 января 2009, 2009",Ольга Тимофеева,,Деревня капиталистического труда,2009,"нехудожественная, публицистика",статья,"дом и домашнее хозяйство, искусство и культура, производство","«Русский репортер», № 1-2 (080-081), 22-29 января 2009",2009,журнал,омонимия не снята,"Горка стружек на полу,острый запах липы, в уголке сложены « стулья» ― поленья то есть. [Ольга Тимофеева. Деревня капиталистического труда // «Русский репортер», № 1-2 (080-081), 22-29 января 2009, 2009] [омонимия не снята]"
",яьжур алуд зи комыд йылеб", йыртсо ,"белый дымок из дула ружья,", острый , , запах пороховой гари.,Вацлав Михальский. Храм Согласия (2008),Вацлав Михальский,1938,Храм Согласия,2008,художественная,роман,_,,,книга,омонимия не снята,"Вспомнил, как с плоской крыши сакли салютовал из охотничьего ружья в честь новорожденного сына старый муж роженицы ( наверно, мужу было чуть за тридцать, но тогда он показался ему очень старым), вспомнил белый дымок из дула ружья,острый запах пороховой гари. [Вацлав Михальский. Храм Согласия (2008)] [омонимия не снята]"
.екниднолб ан ясливонатсо дялгзВ, йыртсО ,Взгляд остановился на блондинке., Острый , , запах лайма мешался со слабым,"Дмитрий Колодан, Карина Шаинян. Над бездной вод (2007)","Дмитрий Колодан, Карина Шаинян",,Над бездной вод,2007,художественная,рассказ,_,,,книга,омонимия не снята,"Взгляд остановился на блондинке. Острый запах лайма мешался со слабым ароматом водяных цветов ― почему-то было понятно, что это не духи. [Дмитрий Колодан, Карина Шаинян. Над бездной вод (2007)] [омонимия не снята]"
-оньлетизремо ( адирдигна огонмен оген, йыртсо ,него немного ангидрида ( омерзительно-, острый , , запах которого выдавил у всех,Михаил Гиголашвили. Чертово колесо (2007),Михаил Гиголашвили,1954,Чертово колесо,2007,художественная,роман,_,,,книга,омонимия не снята,"Пока Борзик высушивал раствор, предварительно влив в него немного ангидрида ( омерзительно-острый запах которого выдавил у всех слезы и проклятия), Художник выволок из шкафчика железную коробку со шприцами: один треснут, на втором поршень разболтан, а третий ― громадный, конский, кубов на двадцать. [Михаил Гиголашвили. Чертово колесо (2007)] [омонимия не снята]"
"а ,йокер ьсолил онив ималотс", йыртсо ,"столами вино лилось рекой, а", острый , , запах шашлыков и репчатого лука,А. Е. Рекемчук. Мамонты (2006),А. Е. Рекемчук,1927,Мамонты,2006,художественная проза,роман,_,,,книга,омонимия не снята,"Были и гости из более близких краев ― например, с благодатного Кавказа,  ― за их столами вино лилось рекой, аострый запах шашлыков и репчатого лука разносился по всему залу, щекоча ноздри, там звучали громкие голоса, иногда срывающиеся в гортанный запев. [А. Е. Рекемчук. Мамонты (2006)] [омонимия не снята]"
с иматкудорп ясьтимокал ьтсоннолкс ашан, имыртсо ,наша склонность лакомиться продуктами с, острыми , , запахами ― с тех времен».,"Виктория Скобеева. От Фрейда к Даррелу // «Знание - сила», 2006",Виктория Скобеева,,От Фрейда к Даррелу,2006,"нехудожественная, учебно-научная",статья,"биология, наука и технологии, психология, социология",«Знание - сила»,2006,журнал,омонимия не снята,"Но наша склонность лакомиться продуктами сострыми запахами ― с тех времен». [Виктория Скобеева. От Фрейда к Даррелу // «Знание - сила», 2006] [омонимия не снята]"
оливолу алваП еинянобо ацпук яиназлопдоп, йыртсо ,подползания купца обоняние Павла уловило, острый , , запах лука.,"Игорь Андреев. Желтый ящик // «Знание - сила», 2006",Игорь Андреев,,Желтый ящик,2006,"нехудожественная, публицистика",статья,"история, политика и общественная жизнь",«Знание - сила»,2006,журнал,омонимия не снята,"По мере подползания купца обоняние Павла уловилоострый запах лука. [Игорь Андреев. Желтый ящик // «Знание - сила», 2006] [омонимия не снята]"
".тыс ежу отч ,тивяаЗ", еыртсО ,"Заявит, что уже сыт.", Острые , ," запахи не возбудят его, исходящий","Андрей Рубанов. Сажайте, и вырастет (2005)",Андрей Рубанов,1969,"Сажайте, и вырастет",2005,художественная,роман,_,,,книга,омонимия не снята,"Заявит, что уже сыт. Острые запахи не возбудят его, исходящий от еды пар не вызовет слюноотделения. [Андрей Рубанов. Сажайте, и вырастет (2005)] [омонимия не снята]"
",нлов муш отэ ― ьнатерБ", йыртсо ,"Бретань ― это шум волн,", острый , , запах водорослей и беспокойные крики,"Дарья Глебова. Бретань: дыхание Земноморья // «Homes & Gardens», 2004.04.30",Дарья Глебова,,Бретань: дыхание Земноморья,2004,"нехудожественная, публицистика",статья,путешествия,«Homes & Gardens»,2004.04.30,журнал,омонимия не снята,"Бретань ― это шум волн,острый запах водорослей и беспокойные крики чаек [Дарья Глебова. Бретань: дыхание Земноморья // «Homes & Gardens», 2004.04.30] [омонимия не снята]"
оньлетивиду от-йокак в янем ялд, йыртсо ,для меня в какой-то удивительно, острый , , запах счастья…,"Ольга Зуева. Любишь меня, а целуешь другую?! // «Даша», 2004",Ольга Зуева,,"Любишь меня, а целуешь другую?!",2004,"нехудожественная, публицистика",статья,частная жизнь,«Даша»,2004,журнал,омонимия не снята,"На улице была осень, и когда мы шли через парк, набрали букет ярких кленовых листьев, и этот запах осени, резкий запах мокрой листвы, горьковатый аромат клена и теплый мужской запах, исходящий от Роминого пиджака, навсегда соединились для меня в какой-то удивительноострый запах счастья… [Ольга Зуева. Любишь меня, а целуешь другую?! // «Даша», 2004] [омонимия не снята]"
"лираду сон в как ,иншюнок", йыртсо ,"конюшни, как в нос ударил", острый , ," запах, от которого резало глаза",Вальтер Запашный. Риск. Борьба. Любовь (1998-2004),Вальтер Запашный,1928,Риск. Борьба. Любовь,1998-2004,"нехудожественная, публицистика",мемуары,_,,,книга,омонимия не снята,"Едва я открыл двери конюшни, как в нос ударилострый запах, от которого резало глаза и першило в горле. [Вальтер Запашный. Риск. Борьба. Любовь (1998-2004)] [омонимия не снята]"
― екчер к мосел удИ, йыртсо ,Иду лесом к речке ―, острый , , запах земляники: метрах в десяти,"Анатолий Найман, Галина Наринская. Процесс еды и беседы. 100 кулинарных и интеллектуальных рецептов // «Октябрь», 2003","Анатолий Найман, Галина Наринская",1936,Процесс еды и беседы. 100 кулинарных и интеллектуальных рецептов,2003,"нехудожественная, публицистика",эссе,дом и домашнее хозяйство,«Октябрь»,2003,журнал,омонимия не снята,"Или: « Иду лесом к речке ―острый запах земляники: метрах в десяти ( свидетельство вашего звериного обоняния) за кочкой поляна ― вот такие ягоды, как лаком облитые, ослепительные. [Анатолий Найман, Галина Наринская. Процесс еды и беседы. 100 кулинарных и интеллектуальных рецептов // «Октябрь», 2003] [омонимия не снята]"
еелоб еще с и силук, мыртсо ,кулис и с еще более, острым , ," запахом интриг, каботинством, премьерством и","Марина Давыдова. Чайка в небе. Станиславскому исполнилось 140 лет // «Известия», 2003.01.17",Марина Давыдова,,Чайка в небе. Станиславскому исполнилось 140 лет,2003,"нехудожественная, публицистика",статья,искусство и культура,«Известия»,2003.01.17,газета,омонимия не снята,"В изменении роли и назначения театра, если понимать под этим словом не драматургию, а саму театральную практику с запахом кулис и с еще болееострым запахом интриг, каботинством, премьерством и прочими кулуарными прелестями. [Марина Давыдова. Чайка в небе. Станиславскому исполнилось 140 лет // «Известия», 2003.01.17] [омонимия не снята]"
",ысколф еыволил -онжен И", йыртсо ,"И нежно- лиловые флоксы,", острый , , запах которых будоражит память: мое,"Рада Полищук. Портреты // «Вестник США», 2003.12.10",Рада Полищук,,Портреты,2003,"нехудожественная, публицистика",мемуары,частная жизнь,«Вестник США»,2003.12.10,газета,омонимия не снята,"И нежно- лиловые флоксы,острый запах которых будоражит память: мое детство ― букет первоклассницы, прекрасный волшебный сад дворника деда Кузьмы в одесском дворике моей мамы, и кажется мне, что я вижу их в палисадниках дореволюционного местечка Юстинград, где прошло детство моего папы, и на улицах маленького города Горки, на могилевщине, где родился Лев Эммануилович. [Рада Полищук. Портреты // «Вестник США», 2003.12.10] [омонимия не снята]"
"алавовтсвучоп ано отч ,окзилб и", йыртсо ,"и близко, что она почувствовала", острый , , запах серы и испугалась.,"Тамара Орлова. Ловушка для ящериц // «Октябрь», 2003",Тамара Орлова,,Ловушка для ящериц,2003,художественная,повесть,_,«Октябрь»,2003,журнал,омонимия не снята,"Мина решила, что лучше встать и зажечь свет, обозначив свое присутствие, но мужчина вдруг чиркнул спичкой так громко и близко, что она почувствовалаострый запах серы и испугалась. [Тамара Орлова. Ловушка для ящериц // «Октябрь», 2003] [омонимия не снята]"
"юянобо ,ьлетирз как ,я оН", йыртсо ,"Но я, как зритель, обоняю", острый , , запах попсы и чувствую: меня,"Раздвоение имиджа // «Профиль», 2003.07.14",,,Раздвоение имиджа,2003,"нехудожественная, публицистика",статья,политика и общественная жизнь,«Профиль»,2003.07.14,журнал,омонимия не снята,"Но я, как зритель, обоняюострый запах попсы и чувствую: меня тут хотят купить, и купить задешево. [Раздвоение имиджа // «Профиль», 2003.07.14] [омонимия не снята]"
йынчывирпен яслилесоп емод В, йыртсо ,В доме поселился непривычный, острый , , запах младенца.,Михаил Шишкин. Всех ожидает одна ночь (1993-2003),Михаил Шишкин,1961,Всех ожидает одна ночь,1993-2003,художественная,роман,_,,,книга,омонимия не снята,В доме поселился непривычныйострый запах младенца. [Михаил Шишкин. Всех ожидает одна ночь (1993-2003)] [омонимия не снята]
"ясламиндоп юьдащолп дан окосыв ,амалси", йыртсо ,"ислама, высоко над площадью поднимался", острый , , запах их сильно разогретых на,Нина Воронель. Без прикрас. Воспоминания (1975-2003),Нина Воронель,1932,Без прикрас. Воспоминания,1975-2003,"нехудожественная, публицистика",мемуары,_,,,книга,омонимия не снята,"Далеко- далеко уходили направо и налево одинаковые коленнопреклоненные ряды воинов ислама, высоко над площадью поднималсяострый запах их сильно разогретых на беспощадном среднеазиатском солнце тел, упакованных в плотные чапаны. [Нина Воронель. Без прикрас. Воспоминания (1975-2003)] [омонимия не снята]"
и сукв йынярП, йыртсо ,Пряный вкус и, острый , , запах слов- паразитов родины ворвался,"Галина Щербакова. Ангел Мертвого озера // «Новый Мир», 2002",Галина Щербакова,1932,Ангел Мертвого озера,2002,художественная,"рассказ, цикл",_,«Новый Мир»,2002,журнал,омонимия не снята,"Пряный вкус иострый запах слов- паразитов родины ворвался ко мне в дом, даже не переступив его порога. [Галина Щербакова. Ангел Мертвого озера // «Новый Мир», 2002] [омонимия не снята]"
